,rules
720,ce serveur est ouvert à toute personne liée à lenseignement lenseignement supérieur la recherche la communauté éducative sans limite thématique
721,vous acceptez les conditions générales dutilisation des services sciencesre disponibles sur httpssciencesrementionslégales
722,les langues à privilégier sur ce serveur sont le français ou langlais sans pour autant que cela soit une obligation mais cela aide pour la modération en cas de doute si les modérateurs ne parlent pas la langue ils utiliseront des outils de traduction automatique imparfaits
723,la pornographie et la nudité doivent être obligatoirement indiquées comme nsfw de même pour contenus sensibleschoquants qui doivent avoir un content warning approprié
724,le contenu publicitaire na pas sa place sur cette instance les diffusions scientifiques sont bien évidemment autorisées en particulier venant dorganismes à but non lucratifs publics de presses universitaires décoles duniversités
725,les comptes automatisés crosspost automatique depuis twitter par exemple doivent être indiqués comme robots en cochant ceci est un robot dans léditeur de profils
726,
727,
728,
729,
730,
731,
732,
733,
734,
735,se espera de los usuarios que traten a los demás con respeto y amabilidad
736,el objetivo de la comunidad es crear un ambiente de intercambio agradable
737,no se acepta ninguna expresión discriminatoria basada en sexo etnicidad orientación sexual o identidad de genero
738,la administración moderará el contenido según su criterio y actuando de buena fe
739,vlastníkem a provozovatelem mastodon instance cztwittercz je šerif olikočková šerif určuje pravidla a má vždy poslední slovo vymáhat pravidla mu pomáhají pomocníci šerifa moderátoři
740,fotografie a média zobrazující mrtvé osoby či zvířata erotický či pornografický obsah musí být označen jako citlivý obsah pomocí funkce cw
741,je povinné dodržovat netiketu a zásady nekonfliktní mezilidské komunikace je zakázáno jiným uživatelům vyhrožovat vydírat je nebo je jiným způsobem obtěžovat rovněž je zakázáno k těmto činům nabádat ostatní uživatele
742,je zakázáno kohokoli urážet na základě pohlaví rasy barvy pleti jazyka víry náboženství či sexuální orientace
743,je zakázána jakákoli podpora hnutí či politických stran směřujících k potlačení práv a svobod člověka
744,je zakázáno šířit dezinformace výjimkou jsou příspěvky které je uvádějí na pravou míru
745,je zakázáno schvalovat či obhajovat trestné činy nebo k nim ostatní uživatele nabádat
746,je zakázána podpora a propagace terorismu
747,je zakázáno popírat zpochybňovat schvalovat či ospravedlňovat genocidia a válečné zločiny
748,je zakázáno rozesílání spamu a nevyžádaných komerčních nabídek
749,je zakázáno bez předchozího výslovného souhlasu posílat erotický či pornografický obsah jiné osobě
750,posts are moderated our federation depends on being a trustworthy instance obeying local jurisdictions and prohibiting harm and abuse
751,harmful and abusive speech and behaviors include the language and tactics of the white supremacy movement and its affiliations are strictly prohibited and enforced
752,accounts and servers will be permanently banned for engaging in sexual content involving minors including artistic depictions gore and graphic violence national socialism nazism holocaust denial racism alt right gendercritical sex and gender discrimination transphobia misogyny
753,no crypto our federation depends on inhibiting the infiltration of capitalism into the processes of redecentralizing the internet
754,be friendly and keep it civilized
755,this server is no place for hate speech racismfascism and other forms of abusive behavior
756,no things that infringes belgian law such as child pornography or eu law by extent
757,server admins can change these rules at any time if needed these will be communicated in the announcements
758,no incitement of violence or promotion of violent ideologies
759,no harassment dogpiling or doxxing of other users
760,do not intentionally share misleading information
761,organizations and companies must use their organizationcompany email address when signing up although we reccomend that they setup their own instance or using an managed hosted mastodon platform see tos
762,no spam or trolling
763,do not try to inpersonate other users or brands unless its a parody but keep it civilized
764,use content warnings cw where needed such as spoilers and sensitive posts that may trigger other people
765,no nsfw content
766,please consult the admin if you want to use a bot account on this instance
767,posting excessive amount of ads or self promotion is disallowed
768,deze server is voor allen van laag tot hoog in rang die onderwijs een zeer warm hart toedragen we respecteren elkaars mening en laten elkaar in waarde
769,weeslief we hanteren de regels conform nl avg en wetgeving die op moment geldig is
770,donatie graag zelfs en hier vind je alle informatie daarover httpswwwdoneeractienlmastodoneducation69393
771,active moderation against nude racism sexism homophobia and transphobia use your own name
772,this server is for everyone from low to high in rank who have a very warm heart for education we respect each others opinion and value each other
773,actieve moderatie tegen naakt racisme seksisme homofobie en transfobie gebruik je eigen naam
774,be nice we use the rules in accordance with nl avggpdr and legislation
775,valse namen of berichten en indien bewezen resulteert in een ban
776,false names or messages and if proven results in a ban
777,using an bot be aware that to many post can be seen as spam no spamming
778,no content that is illegal in germany
779,the main language on this instance is english
780,no nsfw or other triggers like transphobia etc without cw
781,no hate speechdiscriminationetc
782,no oppressive language or actions
783,no harassmentstalking
784,respect peoples pronouns
785,be excellent to other ppl
786,the minimum age is 18 we cannot host porn since it is illegal in germany nudity is a okay eroticism is okay in german law pornography refers to the explicit depiction of sexual acts or material that primarily aims to sexually arouse the viewer
787,write at least 3 sentences in your application 400 chars max
788,be considerate no discrimination based on race religion sexual orientation gender identity nationality or any other characteristic
789,no trolling do not engage in nonconstructive behavior designed to upset members of the community
790,sexually explicit content must be behind a cw and your bio profile picture banner etc must be completely safe
791,no inciting violence or promoting violent ideologies
792,dont go overboard with media uploads treating famichiki as free personal file storage is inappropriate and disrespectful to our contributors
793,no big corporate advertising or crypto however if you are active in the community and also have a project or small business to share selfpromotion is encouraged
794,bots are allowed within reason spamming the local timeline with repetitivenearlyidentical content is not permitted either set your bot posts to unlisted or try botsinspace instead ask us if youre unsure
795,dont post or use this server for illegal content we are aware of japans questionable laws regarding the protection of minors illegal here also covers all csemcsam
796,not your wank bank accounts with zero community interaction that only follow porn accounts will be banned all accounts following csam including art will also be banned
797,žádný rasismus sexismus homofobie transfobie xenofobie
798,žádné podněcování k násilí nebo propagace násilných ideologií
799,žádné obtěžování dogpiling nebo doxxing ostatních uživatelů
800,žádný obsah nelegální v české republice nebo eu
801,nesdílejte nepravdivé nebo zavádějící informace které by mohly poškodit ostatní
802,sexuálně explicitní nebo násilná média musí být při zveřejňování označena jako citlivá
803,k ostatním se prosím chovejte slušně vyhněte se nadávkám a pokuste se udržovat příjemné prostředí díky
804,discrimination of any kind is prohibited this includes but is not limited to racism xenophobia sexism homophobia transphobia etc
805,content that you do not have permission to post is prohibited
806,spam and or bots are prohibited
807,any political polarizing topics or other stressinducing conversations should be put behind a content warning cw
808,artwork photos images or descriptions eg roleplaying of any kind depicting or describing anyone under 18 in any adult situation is strictly not permitted
809,media showing anything that is generally considered objectionable particularly adult content should be marked as sensitive and include a cw content warning explaining why its marked sensitive
810,be polite and kind dont be a jerk religious speech hate speech discrimination and harassment of any kind is not tolerated on this server
811,be respectful even if you disagree
812,no spam or commercial advertisements
813,this server is intended for anyone who works in search engine optimization seo
814,the primary language for this server is english although it is fine to discuss seo examplescasesdetails related to different markets languages and locales make sure that the primary language of your posts are in english
815,read the about page for best practices and content not allowed on this server
816,sexually explicit or violent media must be marked as sensitive when posting
817,no racism sexism homophobia transphobia xenophobia ageism or casteism
818,no incitement of violence or promotion of violent ideologies
819,no harassment dogpiling or doxxing of other users
820,do not share intentionally false or misleading information unless its a clear joke but youre walking on thin ice and the admins will decide if you plummet to a suspension
821,do unto others as you think they would want done to them
822,mark sensitive content with a content warning
823,illegal content such as child pornography unsurprisingly is not permitted
824,pornography in general is not allowed
825,lack of a specific rule against a certain behavior does not indicate acceptance of that behavior each of us has a limited amount of time in this world dont be a jerk
826,hate speech and abusive or threatening behavior is not permitted specifically that which directed at any gender nationality religion race age pizza topping preference or sexual identity one can hate on systemd all day long here
827,violating one or more of these rules may result in an immediate permanent ban without notice or warning
828,you may not impersonate a person or brand without a clear indication the account is unofficial andor a parody parody accounts are permitted as are legitimate brand accounts
829,english or french only please we have no moderation staff for other languages at this moment
830,gratuitous obscenity that serves no practical benefit to a discussion is not permitted
831,do not break any laws use common sense and knowledge of the laws of your country of residence
832,be kind discriminatory language based on gender sexual orientation religion etc is not tolerated
833,be respectful do not make your issues with another user public either settle it in private or contact a moderator
834,use cw content warnings make liberal use of cw for content including but not limited to lewdkinkypolitics and other polarizing subjectsdrugsgame spoilers as a rule of thumb if itd be awkward to explain in public put a cw on it
835,keep your avatarbanner safe other instances will see these so avoid any explicit or otherwise highly suggestive content
836,credit artwork link back to or at least provide the name of the artist of any and all artwork you post failure to do so repeatably will result in swift account suspension
837,content featuring pedophiliazoophiliairl snuff or goreetc will lead to immediate account suspension this includes characters that are technically of age but look underage
838,while not required alt text is highly encouraged
839,ai images while allowed have to be tagged as such do not claim the artwork as your own provide the ai and settings used in alt text
840,you alone are responsible for any and all content you post to this site you may not post copyrighted content you do not have the right to use
841,impersonating another individual without a clear indication of parody ie parody as part of the display name will lead to swift suspension furthermore parody is only permitted for lighthearted fun meanspirited mockery will still lead to suspension
842,due to the nature of this instance any and all users have to be of age in their respective country or at least 18 years old whichever is higher
843,migrations or new accounts onto this instance as an effort of banblock evasion will lead to swift suspension
844,more rules may be added or changed in the future as necessary this will usually be accompanied by an announcement and reminder to review the rules
845,due to an increase of spam accounts as of late we require approval for signups please provide a simple reason for your signup to ensure its not automated
846,dont be a dick
847,no doxxing of other users
848,no advertising spam or grifting this includes crypto
849,no impersonation of other people companies organizations etc
850,do not automatically repost high volume content from other sites without admin approval
851,dont post anything which would violate the law in either your home jurisdiction under us law or washington state law
852,dont be a jerk hate speech discrimination and harassment of any kind are not tolerated here
853,if you post adult content please mark it as sensitive so that your followers can choose when to see it
854,no spam this includes using completely unrelated hashtags in your posts
855,this instance is intended only for anyone who was ever employed at twitter and select friends
856,please do not use trademarked usernames
857,no misinformation
858,posting personal information without consent doxxing is strictly prohibited
859,posts that are inflammatory inciting or unnecessarily provocative are not allowed
860,posts that stalk or harass other posters in any way are strictly prohibited
861,this community will be intolerant of intolerance see poppers paradox
862,do not share intentionally false or misleading information
863,we will abide by the mastodon server covenant available here httpsjoinmastodonorgcovenant
864,when signing up please include your twitter handle website or other link in the reasons for joining field
865,
866,
867,
868,
869,
870,
871,
872,
873,
874,
875,achte die würde deiner mitmenschen und mitnutzerinnen
876,beachte die geltenden gesetze insbesondere das urheberrecht das persönlichkeitsrecht und den datenschutz
877,solltest du inhalte insbesondere ton video und bild veröffentlichen die andere verstören könnten beispielsweise durch darstellung von gewalt verwende bitte die inhaltswarnungfunktion als heikle medien markieren
878,solltest du eine verletzung dieser regeln bemerken nimm das bitte nicht stillschweigend hin sondern informiere die moderatorinnen unter moderation
879,no hate speech harassment or generally making a nuisance of yourself
880,we will actively moderate against racism sexism homophobia and transphobia any violation of this rule is grounds for immediate and irrevocable termination of privileges as a user
881,this is an instance aimed generally at englishspeaking legal professionals and those in adjacent fields
882,dont harass anyone
883,if someone is harassing you report it to a moderator
884,dont post anything thats illegal in the us we are hosted there
885,mark nsfw content as such using content warnings
886,you must read and accept the code of conduct httpstootpizzaabout
887,do not share intentionally false or misleading information
888,dont join just to advertise something
889,nobody under 18 years old
890,be respectful of all our members
891,original photos and videos only
892,explicit content must be marked with a cw content warning
893,bots are allowed but be civil
894,content considered illegal in finland netherlands and uk is not tolerated
895,this instance is 18 absolutely no underage or illegal content
896,no discrimination including but not limited to racism sexism homophobia or transphobia
897,no incitement of violence or promotion of violent ideologies
898,no disinformation regarding public health issues or politicalmilitary campaigns
899,no spam or unverified use of copyrighted material this includes promotional campaigns and seo if you have a selfrun small business please request permission before linking to any products for sale we would like to make sure all items being sold are legal under this instances usa laws
900,no impersonation of other individuals public figures or organizations unless clearly marked as a parody
901,no explicit nsfw content without content warnings andor sensitive media markers explicit content must not be used in user avatars or header images
902,no harassment of other users on this or other servers
903,final rule only fun is allowed have fun
904,be kind to each other
905,no promotion of violence
906,no promotion of fascism white supremacy etc
907,no promotion of colonialism or nationalism
908,no promotion of racism transphobia homophobia etc
909,no promotion of religious extremism
910,the instance is intended to be an lgbtqia safe space
911,the instance is intended to be a safe space for neurodivergent people
912,content which is unsuitable for consumption in a general public setting should be marked sensitive or carry a content warning
913,supply a link to a social media profile or personal website when signing up
914,do not share intentionally false or misleading information
915,no hate speech derogatory language offensive comments or the use of slurs directed at groups of people especially those historically marginalized neonazi altright and antilgbtq content is explicitly forbidden
916,no incitement or promotion of violence including selfharm and suicide
917,do not hit on people do not pry or inquire into peoples sexual or personal lives
918,no harassment dogpiling bullying or doxxing
919,no nfts no crypto no blockchain
920,nsfw content must be marked as sensitive andor marked with a relevant content warning cw when posting avatars headers and bio content must be appropriate for all audiences
921,no explicit sexual violent or gory content no sexual depictions of minors
922,signups will only be approved for musicians professionals and hobbyists
923,be kind courtesy and respectful
924,no discrimination including but not limited to racism sexism homophobia or transphobia
925,no incitement of violence or promotion of violent ideologies
926,no spam this includes commercial advertising promotional campaigns and seo
927,no impersonation of other individuals public figures or organisations
928,no content that is illegal in the united kingdom
929,absolutely no sexuality explicit content this includes but not limited to imagesvideoschat around sexual acts there are other places on the internet for this
930,your primary reason for having an account on this server should be your interest in family history and genealogy
931,accounts will be deleted one month after registration if the post count remains zero
932,no hate speechdiscriminationetc
933,no oppressive language or actions
934,no harassmentstalking
935,nsfw ie nudity is not permitted on this server
936,no gore or graphic violence
937,respect peoples pronouns
938,no sexual depictions of children
939,no automated spam
940,no doxxing
941,no begging for money giving people the option to donate is totally fine
942,no posting copywritten material or any material you dont own
943,no business accounts for the sole purpose of selling things
944,registrations are only accepted from those who demonstrate a serious interest in food and wine please make this clear in the reason for joining field or we will reject your application see our about page for more details
945,no threatening abusive or intolerant behaviour we have a zero tolerance policy on racism sexism homophobia and transphobia your account will be suspended in such cases
946,no commercial advertising political campaigningpropaganda duplicate accounts or impersonating legal entities all such accounts will be suspended and potentially removed
947,you must be at least 18 years old to use this service
948,our servers and data are located in germany anything illegal in germany andor the european union is prohibited
949,after registering please edit your profile add a short bio and post a short introduction to yourself we may delete inactive accounts where this has not been done after 30 days
950,
951,
952,
953,
954,
955,
956,
957,
958,
959,no rules
960,no trolling microaggressions or harassment
961,no racism sexism discrimination against gender and sexual minorities ableism fatmisia xenophobia andor violent nationalism or the advocation of all of the above
962,no bots
963,no pornography
964,upload distribute only content that you have permission for
965,no ads except for featuring your own creative metal music content music articles reviews
966,accounts with no activity will be deleted after 1 year from the time of the last login
967,seksuālus vai vardarbīgus ierakstus lūdzu marķēt kā sensitive cw
968,nav atļauts rasisms seksisms homofobija transfobija vai ksenofobija
969,nav atļauta vardarbības veicināšana vai vardarbīgu ideoloģiju sludināšana
970,nav atļauta naida runa ieraksti kas pazemo citus lietotājus vai atklāj to privāto informāciju doxing
971,nepubliskojiet saturu kas ir aizliegts latvijā vai vācijā jo daļa serveru atrodas tur
972,nav atļauts apzināti izplatīt maldinošu informāciju un viltus ziņas
973,no hate speech
974,dont be a dick if you are mods reserve the right to talk to you suspend you temporarily or suspend you permanently in that order
975,selfpromotion is fine but you should be fannish or friends with folks on this server do not join to promote commercial content
976,sexual content depicting characters who are not sexually mature is banned underage is a fungible category we know this do not post any content that could be described as shotaloliconetc prior to performing any account limiting activities mods will contact you to discuss
977,if you dont like what you are seeing block or mute report if it violates the rules move on do not harass users about ship preferences in any way note discussion of racism homophobia etc in fandom does not constitute harassment
978,this is a server for the girls the gays seeks to provide a transinclusive antiracist space we are not a space for rightwing fans
979,by joining this server you are asserting that you are legally an adult in your country of residence
980,please use your best judgement when posting nsfw or other sensitive content such as posts about political violence screenshots of rightwingers etc nsfw images must be marked as sensitive and a cw should be used
981,username format usernames can be alphanumeric and have underscores but dashes and other special characters are not allowed this is enforced at the mastodon software level so its not a rule but we want you to know before you try to sign up thanks
982,sexually explicit or violent media must be marked as sensitive when posting
983,no racism sexism homophobia transphobia xenophobia or casteism
984,no incitement of violence or promotion of violent ideologies
985,no harassment dogpiling or doxxing of other users
986,no content illegal in usa
987,do not share intentionally false or misleading information
988,automated posting activity must have approval from admin accounts registered for the purpose of posting spam such as seo backlinks or marketing material will be removed by moderators book related activity does not apply
989,posts with an affiliate link must have ad
990,no online gamblinggaming links allowed
991,posts that are bot generated cannot dominate the timeline
992,posts that are bot generated will be silenced to one post a day we prefer human interaction with the posts
993,this server is generally intended to improve communication within the hpc community commercial use for nonrelated purposes spam or other abuse is prohibited
994,personal use is permitted and personal opinions and posts allowed but please do not coopt this instance for entirely nonhpcrelated commercial or other purposes be sure to fill out your profile information to help decide whether to follow or interact
995,this server is federated with others in the mastodon network and may display content from other servers selecting the local timeline may increase your fraction of hpcoriented posts
996,please use hashtags such as hpc to increase discoverability outside of this server using camelcase in your hashtag makes it more useful to those who use screen readers and be sure to add alt text to any media
997,be respectful and aware that abusive or illegal behavior or other violations of server rules will lead to suspension of access
998,by selecting accept you certify that you are over 13 years of age and agree to the terms of use and privacy policies for this service
999,wir gehen einladend inklusiv und respektvoll miteinander um
1000,wir kommunizieren gewalt und unterdrückungsfrei
1001,wir bewerten menschen nicht anhand ihrer religion konfession oder anderer persönlicher merkmale
1002,wir posten keine inhalte die gegen geltendes deutsches recht verstoßen
1003,werbung ist bei uns unerwünscht wenn es nicht um kirchliche diakonische mildtätige oder gemeinnützige zwecke geht
1004,wir lösen konflikte über direkte private kommunikation dm die moderation schalten wir nur bei regelverstößen ein
1005,no difusión de contenidosactividades ilegales en argentina
