,rules
0,for an extended description of every rule please read our about page
1,be friendly
2,dont start shit
3,obey the law
4,spam is not allowed
5,be aware of the nature of the network
6,fascism is incompatible with a free exchange of ideas
7,admin decisions are final
8,these goal of these rules is to ensure a safe and welcoming environment
9,ｔ ａ ｎ ａ ｓ ｉ ｎ ｎ
10,respect everyone we actively moderate against racism sexism homophobia transphobia any kind of discrimination
11,no nsfw without at least having a contentwarning andor posting as unlisted
12,any content that is illegal in belgium france or germany is prohibited
13,do not gather information about our users by means of web scrapers or other software alike
14,dont spam
15,respect each other
16,dont spam
17,dont post illegal content
18,nsfw content should be posted under content warning the nsfw filter or as unlisted
19,use content warning for spoilers
20,bots and commercial accounts are prohibited
21,accounts with lots of media content imagesvideosaudio are prohibited hosting costs money
22,your account may be frozen silenced or suspended for any reason at the discretion of the moderators racists nazis xenophobes transphobes complotists antivaxxers prolifers etc are not welcome
23,accounts that are inactive not signed in for more than a year will be deleted the username will not be freed
24,louverture et lutilisation dun compte sur cette instance implique le respect de la législation française en vigueur
25,tout contenu manifestement illégal sera supprimé ou bloqué dès lors quil est signalé à léquipe de modération
26,afin de ne pas encourager le harcèlement en ligne tout pouet signalé comme injurieux ou constituant aux yeux des personnes qui le voient une agression sera supprimé la répétition des signalements de ce type peut entrainer la suspension du compte ajout le 2 août 2023
27,le fascisme le racisme et lantisémitisme avancent souvent masqués sur les réseaux sociaux si un pouet est signalé pour lune de ces raisons il sera traité et supprimé comme tel même sil peut paraitre inoffensif la répétition des signalements amènera à la suspension du compte
28,
29,
30,
31,
32,
33,
34,
35,
36,
37,
38,look at and comply with our social contract
39,participate in an authentic and active way in doing so you contribute to the health and longevity of this community
40,exercise consideration and respect in your speech and actions
41,attempt collaboration before conflict
42,refrain from demeaning discriminatory or harassing behavior and speech
43,be mindful of your surroundings and of your fellow participants alert community leaders if you notice a dangerous situation someone in distress or violations of this code of conduct even if they seem inconsequential
44,
45,
46,
47,
48,
49,
50,
51,
52,
53,
54,
55,
56,
57,
58,
59,
60,你發佈的內容屬於你你需要為它們負責 you own what you post and are responsible for it
61,請勿發佈惡意傷害性騷擾歧視或非法的內容 no malicious abusive harassment discriminatory violent or illegal content
62,我們不保證能長期在線或者效能流暢請緊記備份 we cannot guarantee the availability or performance of this service
63,你的 ip 位址活動時間活動網址均有紀錄以作維護本站服務用途 your ip address time request url is logged on the server for maintenance purpose
64,伺服器守則可能會在未來進行修訂 this server rule may be modified in the future
65,no harassment for a detailed definition refer to the xoxo code of conduct at xoxofestcomconduct
66,no hate speech including but not limited to sexist racist homophobic and transphobic posts
67,no illegal content or activity
68,use content warnings for adult content or posts that may be disturbing or triggering
69,no sharing personal information about others without their consent
70,no intentional sharing of false or misleading information
71,no spam selfpromotion is welcome sending mass unsolicited replies is not
72,this is a safe and welcoming community abusive or antisocial behaviour will not be tolerated
73,in particular no hate speech or bigotry including dogwhistles implicit but deliberate discrimination through coded language
74,no posting others personal information or private exchanges without permission
75,do not continue to engage a person or incite others to do so after they have requested otherwise
76,no content that is illegal in the united kingdom germany or france this includes grey area content such as sexualized artistic depictions of minors
77,sexual or sexually suggestive content must be tagged as such with a clear content warning avatars and profile banners must be clean
78,same goes for artistic depictions of graphic violence or gore real pictures and recordings of gore and violence are generally not acceptable you better have a really good reason shock value is not a good reason
79,bots are ok as long as they dont post to the public tl more than twice a day and dont interact with folks out of the blue that means no followbots
80,when in doubt about something youd like to post ask a mod when in doubt about something you saw posted report liberally
81,we may take administrative action for reasons not listed here
82,fühl dich wie zu hause in bonn benimm dich so als könnten wir uns morgen wieder persönlich auf der straße begegnen
83,als nutzerin von bonnsocial bist du für deine eigenen inhalte verantwortlich
84,missbrauch kannst du mit den reportingtools oder unter emailbonndigital melden
85,wir entwickeln die regeln für diese instanz so weiter dass sich hier jeder wohlfühlen kann
86,このサーバーが設置されている日本の法律に従ってください
87,故意にこのサーバーや連合している他のサーバーそしてそれぞれのユーザーに迷惑をかけないでください
88,人であることをバレてはいけない
89,あなたはbotそうあなたはbotなのです
90,no racism
91,no sexism
92,no queerphobia
93,no fascists or fascist adjacents
94,no ableism
95,みんななかよく
96,日本国内の法律及び各自治体の条例を守ってください
97,過度に露骨な性や暴力を表現した投稿はしないでください
98,差別的な行為や誹謗中傷などは行わないでください
99,no se aceptan cuentas ni bots de marketing
100,no porn de ningún tipo soft loli etc
101,no discriminación raza género preferencia identidad clase etc
102,no se acepta propaganda política de ningún tipo de ninguna persona de ningún país
103,no spam usar la cuenta solo para anunciar productosservicios crossposting postear imágenes yo texto indiscriminadamente etc
104,toda expresión de odio acoso o ataque personal está prohibido
105,todo tema controversial como política debe publicarse con un content warning cw
106,no difusión de contenidoactividad ilegales en uruguay
107,no contenido con pedofília acoso doxxing o violencia explícita
108,no discriminación homofobia xenofobia sexismo discurso de odio
109,no contenido o apología a la violencia fascismo o nazismo
110,no inundar visualmente ni bots ni cuentas con fines de marketing
111,no publicaciones sexualmente explícitas sin advertencia de contenido
112,nie używaj rasistowskich seksistowskich homofobicznych transfobicznych ableistycznych lub w inny sposób dyskryminujących innych ludzi wypowiedzi unikaj języka nienawiści nie promuj nienawistnych ideologii
113,nie wolno nękać ani uczestniczyć w grupowym nękaniu kogokolwiek lub w inny sposób angażować się w ataki osobiste publikowanie lub grożenie publikacją danych osobowych innych osób jest traktowane jako nękanie
114,pisanie postów za pomocą automatycznego narzędzia jest w porządku o ile jesteś aktywnym członkiem społeczności nie lubimy kont których aktywność sprowadza się jedynie do automatycznej publikacji postów
115,nie zamieszczaj spamu tooty posty które nie są niczym innym niż linkiem ilub zawierają nadmierną ilość hashtagów możemy potraktować jako spam podobnie jak każdą nadmiernie komercyjną autopromocję pisz o swojej działalności ale nie rób tego w przesadnie komercyjny sposób
116,unikaj publikacji postów na tematy zapalne i kontrowersyjne bez ostrzeżenia o takiej treści mastodon ma narzędzie do oznaczania takich postów więc korzystaj z niego jeśli publikowana treść może być kontrowersyjna dla niektórych odbiorców
117,staraj się nie angażować w wyzwiska nieprzyjemne epitety ataki ad hominem ani inne niegodne zachowania krytykuj idee niekoniecznie ludzi
118,nie stawaj w roli policjanta wpis może naruszać standardy grzeczności które ustaliliśmy ale postaraj się nie krytykować użytkowników za jego sposób czy ton komunikacji nie angażuj sie w to jeśli w jakiś sposób dana ci przeszkadza możesz użytkownika zgłosić lub nie krępuj się go zablokować
119,mastodonpl to instancja dla polskiej społeczności stąd taka domena i nazwa mastodon polska staraj się pisać w naszym ojczystym języku dopuszczamy język angielski ale umówmy się niech to nie będzie język dominujący i jedyny w twoich postach
120,日本国内法は守ってください
121,露骨な性表現や暴力的なメディアの禁止
122,差別行為暴力行為を行わないこと
123,他のユーザーに対する嫌がらせ行為の禁止
124,the safety of yourself of others and of property should have highest priority
125,safety is more important than getting boosts and faves
126,be subtle leave no evidence you were here
127,brute force is the last resort of the incompetent
128,leave things as you found them or better cause no permanent damage while on this instance if you find something broken contact an admin
129,do not steal anything if you must borrow something leave a note saying when it will be returned and remember to return it
130,do not drop things without a ground crew to make sure no one is underneath
131,shitposts are not graffiti and should not be seen by the general public shitposts exhibit ones pride in having had an interesting thought and should be seen only by other fedizens keep shitposts small and respect other posters shitposts
132,never drink and post
133,never post alone have someone who can get help in an emergency
134,know your limitations and do not exceed them if you do not know how to boost a post send a dm etc then learn from someone who knows before trying
135,learn how not to get caught but if you do get caught accept gracefully and coöperate fully
136,share your knowledge and experience with other posters
137,above all exercise common sense
138,テーマは設けていません自由に投稿してください
139,エログロやspam過度の連投や自動大量フォロー個人情報の書き込みの他法に抵触する可能性のある投稿があった場合には管理人の判断で予告なく消去する場合アカウントの停止を行う場合がありますまた成人向画像についてはたとえ画像にnsfwの処置があっても管理人の判断で予告なく消去する場合アカウントの停止を行う場合があります
140,人種差別外国人差別民族差別性差別lgbtq差別などの差別発言やヘイト発言またそうした差別につながる可能性のある発言も厳禁です
141,小児性愛など性的な同意をすることができない対象に対する性的欲求の発露表現画像テキストの掲示を行うことを禁止します社会的な話題として小児性愛について扱うときには内面で幼児小児を対象とした性愛性的嗜好を持つペドフィリアと違法行為を実行する児童性虐待者チャイルドマレスターを混同せず区別して論じてください
142,その他 規約に明確に規定されていなくても管理者の判断で不適切と判断した場合投稿に関する削除停止修正要請を行う場合やアカウントの制限停止削除を行う場合があります
143,please be open to any user or any content that hold different opinions with you
144,any content that introduces or instigates criminal offenses or introducing others to approach incite violence or any terrorism content or personal attacks towards other users are prohibited
145,any content that introduces or instigates suicide sales or provides lethal substances antipersonnel weapons and methods of making them which may endanger the personal safety of other users are prohibited
146,no content that violates the law of japan and your nation is allowed
147,use the content warning cw switch for any possible sensitive nsfw content or anything that might make others uncomfortable to avoid troubles for other users
148,please note that activitypub network is not anonymous any data may be public accessible or be provided to law enforcement agencies under proper legal framework
149,please no politic conversations
150,accounts posting large amount of adult content or posting mainly adult content are not welcomed
151,administrators reserve the final right to judge whether any given content is appropriate or not
152,behave according to the laws of japan 日本の法に従ってください
153,any discrimination is not allowed いかなる差別も許容しません
154,spoilers pornography violence etc should be marked sensitive when posting ねたばらしポルノグラフィ暴力などはcwnsfwしてね
155,we do not welcome sexually explicit content エロ系の内容はあんまり歓迎しません
156,see the guideline for more detail 詳しくはガイドラインを見てね
157,babilu esperante
158,ne estu anusuloj
159,ne forgesu la akuzativon
160,no discriminatory behaviour and content promoting or advocating the oppression of members of marginalised groups
161,no threatening behaviour stalking doxxing mobbing including namecalling intentional misgendering or deadnaming
162,no harassment including brigading dogpiling or any other form of contact with a user who has stated that they do not wish to be contacted
163,no conspiracy narratives nationalist propaganda reactionary myths nazi symbolism or promoting the ideology of national socialism
164,do not publish private conversations except to the moderation team if you need to report them
165,no corporate accounts no excessive advertising no bots or automated crossposters from other networks
166,use content warnings cw for sexually explicit or violent media and other content that might be common triggers
167,no illegal content abide by laws
168,you agree to our complete code of conduct tootsiabout
169,アダルトr18コンテンツの制限 当サーバーではnsfwメディアの閲覧注意cwcontent warningの付いていないアダルトr18コンテンツの投稿を認めておりません 必ず適切に設定をしてください
170,迷惑行為の禁止 サーバーへの負荷行為他者への迷惑行為を禁止します その他上記ルールに問わず国内法に反する投稿はすべて投稿削除アカウント停止対象となります
171,使い捨てメールアドレスでのアカウント作成の禁止 使い捨てメールアドレスなど基本的に永続的に所有権のないメールアドレスでの登録を禁止します
172,be civil polite and respectful in your posts and replies
173,read the full list of rules and acceptable behaviour and content standards these are available at httpsaboutscicommxyz
174,use the content warning cw feature for your posts when necessary if you are not sure do it anyway treat it like a subject header for your message more info httpsaboutscicommxyzdokuphpidinfocws
175,avoid crossposters wherever possible if you do use a crossposter then be sure to maintain regular direct engagement with your account here more info httpsaboutscicommxyzdokuphpidinfoabout_bots
176,no language or imagery which is spam or advertising harassing pornographic violent xenophobic nationalistic racist sexist homophobic transphobic ableist or otherwise discriminatory
177,no bots this instance is for humans only more info httpsaboutscicommxyzdokuphpidinfoabout_bots
178,include an image description to all images the description should describe the content of the image more info httpsaboutscicommxyzdokuphpidinfoimage_descriptions
179,do not use url shortening services always include the full url in your posts copied from the address bar of your browser all urls count as 23 characters in your post regardless of their length long or short more info httpsaboutscicommxyzdokuphpidinfourl_shorteners
180,you will not conduct bulk recording or archiving of material from this instance without specific written consent from all users and the administration and moderation team ie do not scrape this instances data
181,important read me before you proceed please visit httpsaboutscicommxyzdokuphpidnewaccounts to understand our account registration and approval process if you do not understand the process then your account request may be rejected
182,みんな仲良く
183,beteilige dich authentisch und aktiv dadurch trägst du zur gesundheit und langlebigkeit dieser community bei
184,verhalte dich rücksichts und respektvoll in wort und tat
185,bemühe dich um zusammenarbeit damit du konflikte von anfang an vermeiden kannst
186,nimm abstand von erniedrigender diskriminierender oder belästigender sprache und verhalten
187,achte auf deine umgebung und die anderen teilnehmenden mache die admins darauf aufmerksam wenn du eine gefährliche situation jemanden in bedrängnis oder verletzungen dieses verhaltenskodexes bemerkst selbst wenn sie zunächst belanglos erscheinen
188,bot accounts are generally not permitted ask first
189,chinwag is for people not brands sign up as yourself not your project
190,dont upset the regulars the longer youve been here the more slack you get
191,no harassment or bullying allowed ever
192,were not prudes but dont get overly sexual without content warnings
193,were mostly australians and dont fucking care if you swear a bit
194,see httpsbsdnetworkterms
195,
196,
197,
198,please see the rules here httpsglaceonsocialaboutmore
199,respect the selfidentity experiences and personhood of others all kinds of plurality are welcome here as are all kinds of headmates keep in mind that others may not use the same language that you do
200,bigotry hatred and oppression have no place here exclusionary rhetoric eg asexual exclusion is also not welcome terfs swerfs white supremacists and cops can fuck right off
201,harassment trolling flaming impersonation and other kinds of abuse are not allowed please treat someone blocking one headmates account as a block of your whole system also keep in mind that public gossip subtoots may cross the line into harassment
202,use content warnings for posts about sex kink and genitals preferably more specific than nsfw please also use content warnings for common triggers longer list in about
203,no loli shota or kodocon or otherwise sexualized images of minors even if fictional
204,no spam no corporate advertisements selfpromotion is welcome please feel free to advertise your commission slots or donation link or personal work
205,dont get us into legal trouble this includes for example being under 13 years of body age full service sex work credible threats of violence doxxing selling illegal drugs
206,dont try to take advantage of the rules to harm others
207,glammrus is a space for folks interested in productive conversation about well galleries libraries archives museums memory work and records
208,we want this to be a fun pleasant and harassmentfree experience for everyone regardless of gender gender identity and expression sexual orientation disability physical appearance body size race or religion
209,we do not tolerate harassment of participants in any form participants asked to stop any harassing behavior are expected to comply immediately if someone asks you to leave them alone leave them alone
210,
211,
212,
213,httpsgoconshtootssocialinvite
214,o que queremos queremos que este seja um espaço de contacto partilha e divulgação de informação entre pessoas e coletivos de iniciativas acções e lutas
215,sejam fixes unxs com os outrxs
216,ter respeito pelxs outrxs e as suas sensibilidades no debate e troca de ideias lá só porque tu podes ser mais caceteiro ou não numa discussão não quer dizer que outrxs o também sejam ou se sintam bem com isso
217,não aceitamos racismo sexismo lesbigaytransfobia autoritarismo fascismo quaisquer formas de assédio ou opressão
218,apologia a senhorios
219,divulgação de conteúdos com fins lucrativos
220,you must be 18 years of age or older no exceptions will be granted for age of consent or similar for your region if discovered a minor your account will be suspended
221,no bigotry is permitted we do not tolerate hate speech of any kind including transphobia homophobia islamophobia or any other facet of ones being
222,be respectful treat others with respect assume good faith with everything text has limited ability to convey intent be kind with yours
223,nsfw or kinkdriven content must be behind a cw giving a short summary of the content eg nsfw art inflation while ensuring media is marked as sensitive
224,zero tolerance for attacks harassing other users whether on this instance or another is cause for immediate suspension of your account
225,copyrighted content may only be shared in fair use contexts basically if it would earn a dmca takedown request filed against us dont post it directly
226,take care in sharing sensitive information while the admins here simply dont have the time nor interest to pry in the database law enforcement could still have access as your messages are not encrypted at rest same as nearly all other platforms when in doubt use a private messaging platform
227,we believe in cyberanarchism and like any good oldfashioned anarchist collective we look out for each other therefore we will not tolerate behaviors resembling sexism nationalism racism homophobia transphobia ableism harassment doxxing you probably get the picture
228,content warnings are nice please use them when appropriate as an example posts about food violence or mental health issues should be tagged if in doubt use them people that do not want to see cws can toggle them off in their settings
229,if you use automated posts bots twitter crossposts etc please post them unlisted not appearing in the local timeline still visible to everyone social media is about interaction so we like to have some of that in our local timeline too
230,we do not like twitter please avoid links to birdside if we wanted to see it we had an account over there
231,oh and because were not really huge fans of this whole capitalism thing no ads for stupid stuff thanks
232,please use the why do you want to join box to let us know why do you want to join our instance and to convince us that youre human or a nice nonhuman to make it easier for us to filter spam registrations please also tell us about your favorite forest creature
233,be excellent to each other jwvgoethe 1932 citation needed
234,expectations for thoughtworkers using mastodon are set out in the thoughtworks code of conduct
235,sexually explicit or violent media must be marked as sensitive when posting
236,no racism sexism homophobia transphobia validism xenophobia or casteism
237,no incitement of violence or promotion of violent ideologies
238,no harassment dogpiling or doxxing of other people approach people with politeness and precaution if someone asks you to stop mentioning them or expresses their wish to be removed from a conversation stop immediately and remove them from the discussion
239,no content illegal in france
240,do not share intentionally false or misleading information
241,any reversal of systemic oppression is forbidden examples racism against whites sexism against men heterophobia cisphobia etc
242,content created by others must be attributed and use of ai must be disclosed profiles that only post aigenerated content will not be tolerated
243,use welcoming and inclusive language
244,respect differing viewpoints and experiences
245,gracefully accept constructive criticism
246,focus on what is best for the community
247,show empathy towards other community members
248,no sexualized language imagery or unwelcome sexual attention or advances
249,no trolling insultingderogatory comments or personalpolitical attacks
250,no public or private harassment
251,do not publish others private information such as a physical or electronic address without explicit permission
252,do not engage in conduct which could reasonably be considered inappropriate in a professional setting
253,do not post image video or audio with public visibility without providing a media description
254,understand and follow the full community code of conduct httpsflosssocialabout
255,dont be an asshole
256,be welcoming
257,be respectful
258,use content warnings and sensitive image tools
259,try to report problems using the report button
260,read and abide by the spirit of our code of conduct
261,you agree to the lurk terms of service by using lurk you agree to first read and stick to our tos httpslurkorgtostxt
262,help keep sealions at bay lurk is here for discussions also the difficult ones however for particularly baity topics including cryptocurrency nft vimemacs and outrage_of_the_day please use the localonly function to prevent attracting bad faith actors from across the network
263,keep the local timeline accessible and tidy local tl is our only truly shared space make toplevel posts public and subsequent posts in the same thread unlisted unless they are very important or updated at slow pace across time like a slowly updated research log or slowly built collection
264,t2f crossposting is spammy f2t is praxis no twittertofediverse cross postinghowever feel free to do fediversetotwitter
