,rules
1006,no se tolera discriminación racismo discursos de odio o variantes
1007,no aceptamos cuentas que sean exclusivamente para spamear ni bots con fines espurios
1008,el contenido nsfw debe estar bajo la etiqueta advertencia de contenido
1009,ära solva kiusa alanda doksi jälita spämmi ega tüüta reklaami või propagandaga
1010,ära ole rassistlik seksistlik homofoobne ega transfoobne
1011,ära õigusta vägivaldseid või äärmuslikke ideoloogiaid ega nende kuritegusid
1012,kasuta siin peamiselt eesti keelt postitamisel määra võimalusel keel
1013,peida cw nupu taha vägivald traumad seksualiseeriv jm tugevalt häirida võiv sisu
1014,järgi eesti seadusi keelatud on nt loomevargus ähvardused vaenu õhutamine pettused väära või kahjustava info teadlik levitamine jpm
1015,ole abivalmis kannatlik ja toeta uusi kasutajaid
1016,no harrasment no stalking no doxxing
1017,no racism or relativization of racism
1018,no sexism or relativization of sexism
1019,no xenophobia or relativization of xenophobia
1020,no discriminating against gender identities or sexual orientations or relativizing them
1021,no advertising
1022,no intentionally misleading content including newaltright conspiracy theories or scams like cryptocurrencies
1023,no content that violates the laws of the czech republic
1024,not for promotion of podcasts
1025,posts do not need to be vocalsynthrelated but do know that this is the general focus of the community
1026,any marginalization or intolerant behavior transphobia racism will be moderated accordingly and may lead to disciplinary action as will obvious attempts to create drama
1027,content must be suitable for all ages and unauthorized reposts of other peoples work is not allowed
1028,no public advocacy or links to piracy
1029,bots must post unlisted or followersonly twitter crossposters must have retweets or quote retweets disabled
1030,keine pornografie
1031,nur bilder und videos and denen du die rechte hast
1032,keine rassistischen oder sexistischen bilder und kommentare
1033,keine verbotenen symbole
1034,be kind and respect each other
1035,contact no one that explicitly stated they do not want to be contacted dont stalk dont doxx
1036,we do not tolerate nazi propaganda weve read karl popper
1037,no porn occasional nudity breastfeeding or naked butts at cold lakes for example is ok though
1038,no spam if you are unsure whether the real life impressions from your bike shop are ok or are considered spam contact the admin team
1039,this instance has no room for racist sexist antisemitic homophobic transphobic ableist saneist content
1040,obey the law when you post content here always mind german law applies eu law applies and the law from the country you are posting
1041,please use cn cw and nsfw where it applies injuries death violence things that might trigger people but do not overuse it
1042,do not stay on topic have a good time
1043,les groupes mim ne peuvent en aucun cas être tenus responsable des propos des utilisateurs de cette instance chaque utilisateur est responsable des contenus quil diffuse devant la loi léquipe de modération suspendra toute personne tenant des propos illégaux
1044,participate in our community by posting your own creative content following our guidelines and pixelfed covenant
1045,reposting bots are not permitted thank you
1046,sexually explicit or violent media must be marked as sensitive when posting
1047,no spam or advertising
1048,no racism sexism homophobia transphobia xenophobia or casteism
1049,no incitement of violence or promotion of violent ideologies
1050,no harassment dogpiling or doxxing of other users
1051,no illegal content
1052,drink coffee not required
1053,content created by others must be attributed and use of ai must be disclosed profiles that only post aigenerated content will not be tolerated
1054,users may not be anonymous at least while this site is in its infancy
1055,users should be scientists journalists or scientificjournalistic institutions or publications
1056,please be as kind polite and understanding as you would be in a cocktail party of friends and strangers harassment racism sexism antisemitism homophobia transphobia or bullying will get you shown to the door
1057,no trolling combative outofleftfield responses to posts seeking argumentation rather than genuine discussion are not welcome
1058,avoid spreading misinformation obviously this can be difficult to delineate and there are many gray areas but repeated andor deliberate spread of misinformation is not allowed
1059,relentlessly pushing a theory or idea in its extreme crankery is not welcome the line is blurry but it can be crossed again think cocktail party feel free to discuss ideas but if people are likely to start sidling away its an issue
1060,the content warning flag should be used for nsfw content nsfw media should be marked as sensitive
1061,users must be 18 or older
1062,be nice we want everyone to feel comfortable here
1063,be welcoming we support people of all backgrounds and identities
1064,refer to people the way they ask you to if you cant find their pronouns on their profile ask
1065,mark nsfwr18 posts as sensitive
1066,add content warnings to sensitive posts eg involving gore
1067,do not make unsolicited advances towards other members
1068,cryptocurrencynftrelated spam is not allowed
1069,bots need to be marked as bot accounts and may not be spammy in nature
1070,doxxing andor disclosing private information is strictly prohibited
1071,read the instructions at httpsvtsocialabout before applying
1072,no child pornography
1073,保持友善善用折叠屏蔽功能
1074,不鼓励发布色情暴力内容如发布务必主动标记为敏感内容
1075,请尽量避免将用户消息截图转发至其他平台
1076,個人情報など他人のプライバシーを侵害する投稿は禁止です
1077,日本の法律に触れる投稿は禁止です
1078,政治宗教などをはじめとしたデモ活動の拠点にする行為特定の政治団体党宗教団体またはそれらに関連するものへの支持を強要勧誘する行為は本サーバーではできませんまた人格否定や価値観の押しつけは禁止です
1079,暴力やテロ行為差別をほのめかす投稿等は禁止です
1080,嫌がらせや誹謗中傷などは禁止です
1081,グロテスクや成人向けなどのセンシティブな投稿を禁じます 同人誌即売会に出せるイラスト等は問題ございませんただし極度な露出やcwを設定していない場合は例外となります
1082,情報商材スパムやマルチポストなどの迷惑行為その他不適切な投稿を禁じます
1083,コンテンツ配信後30日以内のネタバレや18禁イラストなどの投稿はcw閲覧注意を必ずつけてください基準は利用規約に準じます
1084,歌ってみたなどを投稿する際はjasracなどと契約している別サービスで動画を投稿しリンクを貼る形式でお願いいたしますクリエイターさんに還元されるためによろしくお願いいたしますご自身で契約いただき投稿は可能です
1085,be kind dont be a dick
1086,if it would be fine in a bar or public leather event space it doesnt need a content warning here use content warnings for things youd take to the back bar or a private room
1087,were transinclusive bodypositive and antiracist here
1088,you must be over 18 years of age
1089,you must have the legal rights to any content you post
1090,agree to observe the drupal code of conduct httpswwwdrupalorgdcoc
1091,no hacking
1092,no violence
1093,no fascism
1094,no colonialism
1095,no white supremacy
1096,no religious extremism
1097,no nationalism
1098,no racism
1099,no homophobia
1100,no transphobia
1101,safe space lgtbqia
1102,safe space neurodivergent adhd autism etc
1103,no misogyny
1104,treat everyone with respect
1105,les contenus particulièrement explicites devront être postés avec loption pour flouter laperçu cw
1106,publicité pour activités illégales sur le territoire français sont interdites combats danimaux site de pari en ligne sur les animaux
1107,
1108,
1109,
1110,
1111,
1112,
1113,
1114,
1115,nichts diskriminierendes jegliche form von diskriminierung ist verboten das inkludiert ist aber nicht beschränkt auf ableismus antisemitismus homofeindlichkeit islamophobie klassismus rassismus sexismus transfeindlichkeit etc
1116,nichts ungesetzliches poste nichts ungesetzliches österreichisches recht eu recht
1117,nichts belästigendes kein spam trolling bullying oder ähnliche belästigungen keine aufrufe zu hass oder gewalt keine pornographie
1118,nichts automatisiertes keine bots kein crossposting zb spiegeln von twitter posts etc
1119,nichts absichtlich fälschliches keine fakenews falschinformationen wissenschaftsleugnung keine verbreitung von gerüchten oder propaganda
1120,hinweis für unternehmenskonten unternehmenskonten unternehmensähnliche konten undoder geschäftskonten sind nur mit einschränkungen erlaubt inoffizielle unternehmenskonten werden gesperrt bezüglich unternehmenskonten wendet euch daher bitte vorab an supportfediversefoundation
1121,english translation for our english speaking users we have prepared the the essential documents in our wiki please take a look here httpswikiappsfediatbooksfediversefoundationannouncements
1122,日本の法律と社会規範に従った行動を心がけてください
1123,投稿する際は適切な公開範囲閲覧注意を使用してください
1124,respect des lois françaises et de lunion européenne
1125,la información de esta plataforma es exclusivamente in character ic es decir de dentro del juego la información puede ser usada dentro del juego por cualquiera libremente
1126,el contenido multimedia que se suba debe ser del servidor no se aceptan fotografías ni videos de la vida real cualquier contenido de fuera del juego ooc será eliminado
1127,nos reservamos el derecho a borrar el contenido o cualquier cuenta de usuario incluso aplicar sanciones al usuario o personajes implicados que no respeten las normas del servidor ni las normas particulares de esta plataforma
1128,be kind to each other
1129,be judicial in what you post
1130,please dont post stuff that shows disturbing content violence bodliy harm cruelty etc without using the content warning features err on the side of caution
1131,avoid mansplaining while you may be an expert on a topic in your friend circles its likely that theres someone here who you could learn a lot from mansplaining shuts down those opportunities to learn
1132,please set a user icon it can be anything you want as long as it isnt the mastodon default image
1133,avoid behavior that forces us to create new rules
1134,udržujme společně bezpečný mediální prostor založený na základních lidských právech a svobodách s respektem k sobě samým i svým oponentům
1135,trollům a spammerům vstup zakázán
1136,nesouhlasím s vaším názorem ale udělám všechno pro to abyste jej mohl říkat
1137,zachovejte prosím náboženskou a politickou neutralitu ve svých příspěvcích nášface si chce zachovat tvář neutrálního prostoru kde není protěžována žádná politická strana politická osoba či náboženský směr
1138,za obsah příspěvku na zdi odpovídá jeho autor
1139,pokud se čtenář domnívá že příspěvek na zdi autora porušuje základní listinu práv a svobod a je tedy v rozporu s pravidly této skupiny může jej nahlásit moderátorům
1140,podpořte prosím svobodný přístup k informacím na neziskovém projektu nasfacecz platbou na transparentní účet 2202030573 2010 nebo na httpsblognastubczdonate sledujte videa na httpsnastubcz
1141,do not use slurs or racist sexist homophobic transphobic ableist or otherwise discriminatory or hateful jokes or language or promote white supremacy antisemitism transphobia or other hateful ideologies
1142,do not harass anyone participate in group harassment of anyone or otherwise engage in personal attacks posting or threatening to post other peoples personally identifying information doxing constitutes harassment
1143,do not post adult content including pictures containing nudity or unwelcome sexual attention including sexualized comments or jokes
1144,do not post about inflammatory controversial subjects without a content warning
1145,do not engage in name calling ad hominem attacks or any other uncivil behaviour criticize ideas never people
1146,the administrators reserve the right to remove users or defederate with instances
1147,we suggest using your radio callsign as your username if you dont have one yet want to avoid doxing or are a swl thats ok too
1148,anyone is welcome to report inappropriate behavior they will be listened to and action will be taken this will be anything from a warning to banning moderation decisions will be made using the paradox of tolerance
1149,expect anything you post on mastodonhamssocial to be public including direct messages that way you can never be surprised or embarrassed
1150,any images or videos uploaded to mastodonhamssocial must have an appropriate textual description if you need help with this please ask
1151,your right to free speech does not supersede my right to call you out and kick you out for being a dick
1152,please be respectful of others their age gender sexual orientation gender identity background preference for transistors over valves etc are all _not_ reasons to be a twit
1153,no spam no commercial advertising occasional personal listings are ok no sexually explicit or violent media yes that includes pictures of your gun no threats of violence
1154,no illegal content this server is hosted in california united states
1155,when apply for an account if youve actually read these rules please end your why do you want to join with the phrase badger parsnips
1156,we support selfidentificationdiagnosis as these are often inaccessible due to cost biases and other factors questioning folks are welcome
1157,no racism sexism homophobia transphobia queerphobia ableism etc will be tolerated
1158,no impersonating other people
1159,no harassment of any kind
1160,no shortened links eg bitly tly googl ifttt lnkdin isgd or tco these are malicious because linkshorteners track users without their consent and obscure the destination address which also prevents users from being able to decide whether they want to visit the link beforehand
1161,no advertisements for cryptocurrencies nfts or multilevel marketing schemes
1162,we strongly discourage posting undescribed images or video on public privacy setting
1163,no neurodifferent user is to create crosspost only accounts from twitter rss on public privacy setting on this server note this rule applies to the users of neurodifferentme other instances have their own rules regarding this
1164,no serious dishonesty that is hurtful to others shall be posted by a user on this server
1165,no promotion or support of treatments which aim to suppress characteristics of individual identity aba conversion therapy is permitted on this server
1166,all forms of bigotry including racism sexism homophobia and transphobia are strictly prohibited and actively moderated
1167,no harassment of other users on this or other servers
1168,be neighborly and cordial please let moderators and administrators handle issues as appropriate
1169,no explicit nsfw content without content warnings andor sensitive media markers explicit content must not be used in user avatars or header images
1170,no content illegal in the following countries united states germany
1171,no incitement of violence or promotion of violent ideologies
1172,no disinformation regarding public health issues politicalmilitary campaigns or other matters of public interest
1173,no spam this includes commercial advertising promotional campaigns and seo promoting noncommercial events and causes is ok
1174,expect anything you post on this server to be public including direct messages that way you can never be surprised or embarrassed
1175,please be respectful of others no matter their age race gender sexual orientation gender identity background nationality or any thing else treat others as you would like to be treated
1176,no sexually explicit content allowed
1177,no incitement of violence or promotion of violent ideologies
1178,no harassment or doxxing of other users
1179,do not share intentionally false or misleading information
1180,til að byrja með ekkert vesen og ekkert rugl þróum svo með okkur reglur eftir því sem á líður
1181,no harassment or bullying
1182,no willful abuse of the tools available eg spamming
1183,no bigotry including but not limited to ethnic prejudice sexism racism transphobia ableism including towards those who are neurodivergent antisemitism islamophobia antiroma bigotry or bigotry towards first peoples
1184,no pornography
1185,please use contentwarnings for material where the primary subject is sexual or violentgore other content at the posters discretion please consider your audience
1186,no illegal content that includes child porn copyrighted content of which you are not owner etc
1187,no posts or links to content supporting featuring or promoting hate groups terrorism mass violence or calls to violence
1188,no posts or comments supporting or promoting qanon related content or similarly disproven conspiracy theories moderators have sole discretion to decide if a post violates this rule birds are real the earth is round get over it
1189,no posts or links featuring sexualized depictions of minors whether photographic written drawn anthropomorphic or animated
1190,no pornography featuring depictions of rape or nonconsensual violence
1191,a content warning must always be used when posting all other pornographic erotic or nsfw content whether photographic written drawn or animated
1192,no racism
1193,no visual content depicting executions murder suicide dismemberment visible innards excessive gore or charred bodies all other violent imagery requires a content warning
1194,no visual content depicting animal abuse all other posts related to animal abuse require a content warning
1195,no posting of malicious links
1196,no spam
1197,no threats bullying or attacks on an individual or group
1198,no encouragement or promotion of selfharm
1199,no accounts that impersonate anyone else unless clearly marked as such for the purpose of parody
1200,no hate speech hate speech is defined as derogatory posts or links targeting any individual or group based on race mental or physical disability religion gender identity sex nationality age class or sexual orientation
1201,no shitposting while humorous posts are allowed and actually encouraged there is no place for shitposting here
1202,no racism sexism homophobia transphobia xenophobia ableism etc
1203,no incitement of violence promotion of violent ideologies or violent behaviour of any manner
1204,no doxxing dogpiling or harassment in any form of other users
1205,no spam bots or advertisements
1206,no media and content which is sexual or violent in nature
1207,in order to be able to moderate this server posts need to either be written in dutch or english
1208,sei immer freundlich und höflich behandle andere mit respekt
1209,belästige und beleidige niemanden und unterlasse persönliche angriffeweder allein noch als gruppe das veröffentlichen oder die androhung von veröffentlichung von personenidentifizierenden informationen doxing wird als belästigung ausgelegt
1210,die nutzung oder befürwortung von rassistischer sexistischer homophober transphober behindertenfeindlicher und anderweitig diskriminierender oder hasserfüllter sprache wird nicht geduldet auch pornografische bilder sind nicht erlaubt
1211,nachgewiesene falschinformationenfakenews inkl verschwörungstheorien sind hier unerwünscht
1212,you should have an interest in coding and net technologies either professionally or personally make it clear in your bio or add links to relevant websites
1213,be respectful and kind no personal attacks respect others views and experiences no offensive words
1214,no violence or callout no fascism racism sexism homophobia or transphobia no religious extremism more generally no attack against vulnerable people
1215,share about code share content about you and net ecosystem coding other languages patterns blog posts articles videos events
1216,share about you hobbies lifestyle etc be positive
1217,dont impersonate people or companies you can create an account about an organization or a brand if relevant and you can prove you are eligible to do so and approved by the admins contact us by email before you create an account
1218,samskiftið er á føroyskum
1219,ikki skriva ella deila nakað sum stríðir ímóti føroyskari lóg
1220,almenningurin hevur atgongd til alt sum verður skrivað og deilt á efo íroknað beinleiðis boð
1221,efo tilskilar sær rætt uttan grundgeving at strika upplýsingar og brúkarar
1222,víst verður annars til privatlívspolitikkin privacy policy
1223,no hate of any kind
1224,no harassment of any kind
1225,use content warnings liberally and always when discussing politics
1226,no users under the age of 18
1227,no posting content illegal in the usa
1228,poc shouldnt feel pressured to use cw when discussing their personal experiences around discrimination
1229,people not companies please dont sign up your brandcorporate account on this server
1230,be nice and have fun use content warnings cw and hashtags liberally
1231,no hate speech do not use pejorative or discriminatory language with reference to a person or a group on the basis of who they are in other words based on their religion ethnicity nationality race colour descent gender sexual orientation or other identity factor
1232,criticize ideas not people do not shitpost or post in bad faith engage in name calling or ad hominem attacks
1233,do not harass anyone or post other peoples personally identifying information doxing
1234,do not post illegal illicit or unlicensed content
1235,themes discussions freesolutionsorg les logiciels libres la souveraineté numérique la technologie webrtc communications realtime chat audio vidéo sujets suisses ecologie notre planète
1236,bienvenus en helvétie la devise du pays cest un pour tous tous pour un ici vous êtes responsables dans cette communauté vis à vis du collectif de signaler tout comportement incorrect ou abusif dun utilisateur
1237,aucun comportement ni contenu illégal en suisse merci tout ce qui est interdit comme comportement et publications sur les autres grands réseaux sociaux lest ici aussi
1238,compromis bienveillance dialogue et travail collaboratif dans le respect des croyances et opinions de chacun chaque voix compte et peut sexprimer librement dans le respect et la cordialité
1239,toute personne violente agressive raciste et qui ne respecte pas lharmonie de la communauté sera immédiatement sanctionné après un avertissement cordial la suppression immédiate du compte sera la règle
1240,ce service est mis à disposition gracieusement par freesolutions sàrl il nous sert à tester des solutions que nous proposons à nos clients votre utilisation permet aussi de corriger des bugs dans le code source des projets libres comme igniterealtimeorg
1241,freesolutions os sont les bienvenus et prioritaires tous les utilisateurs de freesolutions os
1242,no advertising or excessive promotion
1243,no bots unless theyre cute funny or useful bots should avoid posting to the public timeline
1244,no pornography nudity or something that would be considered nsfw in a us workplace even behind a nsfw warning
1245,no gore or graphic violence
1246,content that is borderline nsfw or could be construed as nsfw at a glance should be put behind a cw content warning
1247,no racism
1248,no sexism
1249,no discrimination based on gender sexual minority sexual orientation disability physical appearance body size race ethnicity religion or lack thereof caste or national origin
1250,no xenophobia or violent nationalism
1251,no sexual depictions of children
1252,no holocaust denialism nazi symbolism promotion of national socialism or anything that is illegal in the european union
1253,no stalking or harassment
1254,no fake accounts even celebrity joke accounts note this rule does not necessarily apply to remote accounts
1255,you must be 13 or older to hold an account on this service
1256,sexually explicit or violent media must be marked as sensitive when posting
1257,no hate racism sexism homophobia transphobia xenophobia or casteism
1258,no incitement of violence or promotion of violent ideologies
1259,no harassment dogpiling or doxxing of other users
1260,no content illegal in the united states
1261,do not share false or misleading information that may lead to physical harm
1262,不要發布討厭的小廣告
1263,但為保護您的隱私您可以考慮使用vpn登錄並避免使用可能暴露您隱私的郵箱如qq郵箱或以手機號註冊的郵箱139189等郵箱平台等
1264,註冊後2周內請至少使用一次您的帳號發表內容或更換頭像均可
1265,帳號註冊成功以後儘量開啟雙重認證確保帳戶不會被盜或者找回
1266,和推特微博一樣mastodon的私信並未加密管理員可以通過伺服器調取信息本站管理員承諾未經允許不主動調閱任何用戶的私信但請以和微博推特私信一樣的謹慎處理mastodon私信不要在其中暴露您的敏感信息如詳細地址銀行卡帳號密碼等
1267,general stay legal respect international laws including the laws of the united states where this server is hosted and the laws of your own country
1268,general you have 48 hours to comply with or respond to a request from wobblxyz staff before you run the risk of moderation action post deletion account strike etc
