,rules
2505,no illegal content this server has zero tolerance for content illegal in the usa server host or australia operated from such as csam and everything close to it terrorism copyright violations crime instructions etc any domain that hosts illegal content has and will be defederated
2506,no bigotry no racism sexism ableism homophobia transphobia islamophobia xenophobia bodyshaming antisemitism white supremacy fascism nazism casteism or any other hateful discriminatory or harmful ideology
2507,no misinformation no conspiracy theories propaganda sensationalism pseudoscience and disinformation campaigns only information from highquality reputable sources
2508,no harassing nor violating privacy no harassment stalking doxxing dogpiling witchhunting or otherwise violating others privacy no instances bots and anyone who ignores noindexing requests and scrapes reposts others content without their permission
2509,no closed sources nor trackers i will only share nonpaywalled openaccess content from sources that respects user privacy like not requesting disabling adblockers and browser extensions no federation with instances ran by big tech or has a lot of trackers or commercial interests
2510,no nsfw content i want to have a sfw experience on the fediverse and will block users and instances that post or link to nsfw accounts or other content
2511,no spam no trolling or lowquality content nor spamming hashtags with offtopic posts no users and instances with extremely high posting rates that could overwhelm smaller instances like my own
2512,accessibility and inclusion use concise and descriptive alt text in all media uploads and only boost media with alt text respect everyones identity by referring to them by how they wish to identify no inaccessibility deadnaming or misgendering
2513,content warnings cw use cws liberally especially on posts referencing triggers such as but not limited to food eye contact or references to traumatic events
2514,referencing when uploading media always cite the original creator of the media no plagiarism or posting others work without permission or citation
2515,no advocating violence do not threaten others with violence death nor encouraging selfharm nor suicide do not encourage others to threaten these
2516,defederating without explanation this server reserves the right to defederate from other instances for reasons not outlined in these server rules
2517,dont harass people
2518,dont organize or promote hate speech
2519,dont make violent threats or threaten others with harm
2520,put cws on your nsfw content nudes lewds etc
2521,dont promote violent extremism
2522,dont post illegal content
2523,日本国の法律に違反する行為は行わないでください
2524,実在の人物や団体などになりすます行為は行わないでください
2525,他者の著作物は無断で利用しないでください
2526,サーバに極端な負荷をかける行為はご遠慮ください
2527,管理者からの指示には従ってください
2528,肌色多めの投稿にはnsfwを設定してください
2529,be gay do crimes
2530,be kind were all trying our best
2531,this is a transinclusive bodypositive and antiracist space
2532,you must have the legal rights to any content you post
2533,you must be 18 years of age to join
2534,ce serveur est francophone lutilisation dautres langues est tout de même permise sans tomber dans labus
2535,ce serveur est respectueux les propos racistes ou discriminatoires sont interdits
2536,ce serveur est québécois tout le monde est accepté tant quon apprécie tous le québec
2537,ce serveur est restreint si vous voulez vous inscrire veuillez indiquer la raison qui vous incite à le faire car cela permettra de filtrer les éventuels robots logiciels
2538,no explicit nsfw content without content warnings andor sensitive media markers explicit content must not be used in user avatars or header images
2539,no incitement of violence or promotion of violent ideologies
2540,no harassment dogpiling or doxxing of other users on this or other servers
2541,no content illegal in the us
2542,no spam this includes commercial advertising promotional campaigns and seo
2543,do not share intentionally false or misleading information including but not limited to public health issues or politicalmilitary campaigns
2544,no impersonation of other individuals public figures or organisations unless clearly marked as a parody
2545,no discrimination including but not limited to the following racism sexism homophobia transphobia xenophobia
2546,currently limited to trg content creators we will not be accepting viewers at this time see httpsjoinmastodonorgservers for a list of servers you might want to join instead you can follow those on this server from another server
2547,this server is only to be used by active devopsdays cities or regions and active advising core devopsdays organizers for devopsdays related matters
2548,cities and regions are expected to use their devopsdaysorg email address as contact
2549,user accounts belonging to individuals are not allowed at this time unless you are an active or advising devopsdays core organizer or have been invited by a core organizer as a moderator
2550,no racism sexism homophobia transphobia antisemitism hate speech ableism or gender discrimination
2551,no violence threats or incitements to violence to another person or group
2552,no promotion of antidemocratic ideologies
2553,no international misinformation particularly medical misinformation and misinformation designed to suppress or mislead voters
2554,no twitter crossposts or screenshots including copies of posts marked rt
2555,be kind to other users no personal attacks harassment trolling dogpiling or brigading
2556,es gilt mein hausrecht und erweitert die stadionordnung des fc st pauli
2557,diese instanz ist ein safe place nur der hauch von ismus wird geblockt
2558,dont spread misinformation
2559,dont be a insert allinclusive term for a bad mean hateful or otherwise unrefined person
2560,mark images that you wouldnt open in front of normal people as sensitive
2561,if i have to add more rules because of you youve broken this rule
2562,be cool and be kind we are all besties here
2563,hate speech racism sexism homophobia transphobia etc will not be tolerated
2564,do not post or share personal information about others without their explicit consent
2565,respect the privacy settings of users posts and profiles
2566,hate speech threats or bullying of any kind are not tolerated this includes any content that promotes discrimination based on race ethnicity national origin sex gender sexual orientation religious affiliation disabilities or diseases including targeted misgendering deadnaming or promotion of socalled conversion therapy
2567,no explicit content such as pornography or graphic violence mark any mature content as sensitive using the platforms content warning features
2568,avoid posting content that is likely to incite or glorify violence
2569,avoid spamming including excessive posting or sharing of irrelevant content
2570,do not engage in manipulative practices to inflate engagement or follower counts
2571,only post content that you have the right to share respect the intellectual property rights of others
2572,do not share copyrighted material without authorization or proper attribution
2573,users must comply with local and international laws regarding online conduct and acceptable content prohibited content includes anything related to illegal activities or substances
2574,creating accounts for the purpose of impersonating others is prohibited
2575,do not share intentionally false or misleading information
2576,this group will not tolerate racism homophobia transphobia xenophobia nazis or hate speech which will be determined at the sole discretion of the moderators
2577,if you are experiencing hate speech or harassment please report it to the moderators
2578,consent matters use content warnings cw often and always where required see details in the about
2579,nsfw content is allowed behind cw banners
2580,be respectful of others
2581,no harassment or stalking
2582,no posting or sharing another users personal information
2583,no excessive posting of advertisements or requesting for cash see details in the about
2584,農業家庭菜園ガーデニング自然に興味がある
2585,人にやさしく
2586,日本の法律を守るユーザーご自身の責任において利用
2587,誹謗中傷や嫌がらせ人格否定などをしない
2588,主張を他人に押し付けたりしない
2589,スパム行為を行わない
2590,トラブルや損失損害等につきましては一切責任を問わない
2591,未記載の事項ついては運営しながら修正変更していくその旨は本サイトにて通知
2592,常に連絡を取ることができるメールアドレスを登録した状態で利用する
2593,ネットワーク接続元情報を意図的に隠ぺいした状態で利用しない
2594,他人を貶めるような行為は慎んでくださいrefrain from behaviour that puts other people down
2595,他人を尊重し異なる価値観に対しても寛容な態度で接してくださいbe respectful of others and tolerant of different values
2596,my server my rules be nice
2597,
2598,
2599,
2600,
2601,
2602,
2603,
2604,
2605,this server is intended to be a place for dartisans like myself to chat together and explore the fediverse as seen from the dart community however a few ground rules have to apply to users not that im expecting any users to break these but please see below
2606,no privacy violations against other people doxing revealing or sexual images of someone else information about someones health or crimes done against them
2607,no threats against other people
2608,no xenophobia hate speech or incitement to such things
2609,no incitements to break any of the server rules
2610,no spread of violent images sexual violence torture or forced actions
2611,no jerks
2612,不適切な投稿の禁止 スパムまたは r18g 以上のレーティングを含む投稿をしないでください
2613,過激な投稿の禁止 例えば行き過ぎた暴言や科学的根拠の無い陰謀論などが含まれます
2614,サーバーへの攻撃行為の禁止 不適当にサーバーに過度な負荷を与えることを禁止しますこれには ddos や web api の不適切な使用サーバーのクラッキングなどが含まれます
2615,日本国法に違反する行為
2616,成人向けコンテンツは閲覧注意タグを付けて投稿してください 成人向けコンテンツとは r18 のことを指しますまたr18g は第1項で投稿自体が禁止されています
2617,ボットによる投稿は非収載設定で行ってください
2618,あくあたん aquatan をフォローしましょう
2619,あくあたんはbotです
2620,あくあたんと楽しくお話ししましょう
2621,respect for all members is expected at all times this includes refraining from using hate speech personal attacks or any other form of harassment
2622,any post or comment that is deemed to be spam or selfpromotion will be removed
2623,posts or comments that contain illegal or copyrighted content will be removed and the user may be banned
2624,all posts and comments should be relevant to model railroading offtopic posts will be removed
2625,no sharing of personal information of any other member on the board
2626,be mindful of others feelings and be considerate in your interactions with others
2627,posts or comments that violate these rules will be removed and the user may be banned at the discretion of the community administrator
2628,the administrator reserves the right to make changes to these rules at any time
2629,by joining this community you agree to abide by these rules we hope that you will find this community to be a helpful enjoyable and safe place to share your passion for model railroading
2630,no racism sexism homophobia prejudice discrimination etc
2631,use common sense and empathy to be kind to your fellow community members
2632,we appreciate you
2633,bond james bond just kidding maintaining bonds between friends is the idea here more easily being able to keep up with what people are doing
2634,no bullying bullying of any kind will not be tollerated by the admin or host of this instance if bullying is your thing then i am sorry to tell you that on this cove of the web it will not be tollerated you will not be warned
2635,we are all human beings who should be treated equally this means that every set of pronouns every orientation and all who identify differently than their assigned gender are accepted here you love who you love and you identify how you identify
2636,systems meaning those who are plural are welcomed with open arms the instance admin is plural and accepts all plurality types including gateway endogenic traumagenic paragenic etc
2637,if you have a passion for writing this is your place writers are more than welcome here i myself am a writer and i believe in the freeflowing pen all writers are encouraged to show yourselves to the world in the form of your passion
2638,the last rule no spam and there will be limits on how many bots will be allowed
2639,crowdfunding and mutual aid requests are allowed everyone comes on hard times
2640,sexuell explizite oder gewalttätige medien müssen beim posten als sensibel gekennzeichnet werden
2641,kein rassismus sexismus homophobie transphobie fremdenfeindlichkeit
2642,keine anstiftung zu gewalt oder förderung gewalttätiger ideologien
2643,keine belästigung deadnaming dogpiling oder doxxing anderer benutzer
2644,be excellent to each other sei kein arschloch
2645,no adult content that means erotic rp explicit images etc this rule applies for both in and out of character content
2646,outofcharacter content is okay but be clear whats ooc tag ooc posts with the ooc hashtag
2647,no racism queer phobia ableism or other really uncool stuff either in or out of character
2648,use content warningscws for content that may be upsetting either ic or ooc use your best judgement and take feedback gracefully if other members or mods ask you to cw certain topics remember racism queer phobia and adult content isnt allowed either in or out of character
2649,admin decisions on content or rule violations are final
2650,please post in english unfortunately our admins arent multilingual so it would not be possible to moderate effectively in other languages
2651,
2652,behave in a civil polite and respectful manner
2653,dont tell people how to live their lives
2654,if you post in a language that is not english please specify the language of your post
2655,add an informative image description to each image that you upload
2656,do not use ulr shortening services all urls count as 23 characters
2657,use a content warning whenever you feel that a post might reasonably upset someone
2658,dont engage in behavior that will force us to make more rules
2659,we follow the paradox of tolerance here tolerance is offered and expect save in the face of intolerance
2660,we are a leftist instance we will not tolerate fascism
2661,if you are making a business advertisement post it must be tagged with ad
2662,if your account is only going to post links or quotes from another source controlled by you you must make it clear what makes this account different ie a quote account mirroring a blog to the fediverse etc this is to prevent spam accounts
2663,this server is moderated in english we do not object to other languages but the moderation of those languages is going to be via translation tools
2664,if we receive reports that indicate that your content is offensive or harmful to an unfamiliar culture ie if youre posting about regional politics that we have no basis of familiarity in we can not promise objective moderation decisions
2665,blatant hate speech will be result in immediate bansdeletion
2666,cultural appropriation and normalized hate speech ie uses of the gslur shaman totem etc when youre not of the group will receive warnings theres a good chance you didnt know better before and now you do if you disagree the warning is your chance to migrate from this server
2667,this rules list is not comprehensive when reasonable violations will be met with warnings and a chance to migrate your data
2668,nothing discriminatory instances by the fediverse foundation are expressly inclusive and open to everyone therefore any form of discrimination is prohibited this includes but is not limited to ableism antisemitism homomisia islamomisia classism racism sexism transmisia etc
2669,nothing illegal do not post anything illegal austrian law eu law
2670,nothing harassing no spam trolling bullying or similar annoyances no calls for hate or violence no pornography
2671,nothing intentionally fake no fake news misinformation science denial no spreading rumors or propaganda
2672,nothing automated no bots no crossposting eg mirroring of twitter posts etc without context or other interaction
2673,diese instanz ist ein privates projekt was in der freizeit betrieben wird daher gibt es keine auch garantien hinsichtlich der verfügbarkeit
2674,hier sind alle menschen willkommen unabhängig von alter geschlecht hautfarbe etc
2675,bei beleidigungen diskriminierungen oder anderem unerwünschten verhalten wird die administration aktiv und kann accounts sperren oder deaktivieren
2676,seid nett und zuvorkommend zueinander denkt bei allen interaktionen immer daran dass am anderen ende ein mensch sitzt
2677,cw questionable stuff mark nsfw when you need to no child sexual content
2678,no harassment and harassment endorsing
2679,just generally be nice please
2680,nett sein
2681,bitte keine profile mit größtenteils werbung
2682,keine verschwörungstheorien
2683,kein content der in deutschland illegal ist speziell das verwenden von verfassungswidrigen kennzeichen und symbolen sowie holocaust und genozidleugnung leglicher art
2684,kein content der in irgendeiner weise gegen das netzwerkdurchsetzungsgesetz verstößt
2685,nazis und coronaleugner werden auf sicht gebannt
2686,es besteht zu keiner zeit ein anspruch auf einen account auf diesem server
2687,这里没有玄学审核没有机器算法这里适度自由但你也需要遵守社区规则并对自己的言论负责
2688,发布仇恨暴力血腥恐怖性别种族歧视裸露色情内容可能会被隐藏删除甚至导致封号
2689,使用电子邮件地址注册用户名支持英文字母数字和下划线验证邮件地址后即可登录使用
2690,كن لطيفا be kind
2691,لا خطاب كراهية من أي نوع no hate speech of any kind
2692,عليك أن تملتك الحقوق القانونية لأي مادة تنشرها وموافقة جميع من فيها you must have the legal rights to any content you post and the consent of people who appear in it
2693,استخدم تحذيرات المحتوى بكرم بالذات عند نشر صور تحتوي على عري use content warnings cws generously especially when sharing nudity
2694,عمرك يجب أن لا يقل عن 18 عام you must be at least 18 years of age
2695,لا تنشر أي محتوى يخالف القوانين الأوروبية أو الكندية do not post anything that is illegal under eu or canadian laws
2696,discrimination bigotry wont be tolerated were not a free speech absolutist were not interested in nazis terfs or hate speech
2697,respect other users this instance is meant to be a friendly welcoming space to all who are willing to reciprocate in helping to create that environment
2698,consent is important in all contexts if youre ever unsure ask first use content warnings cws where required
2699,openly talking ie without a cw about lived experiences is encouraged on this server
2700,listen dont make excuses if youre accused of causing harm either take some responsibility or ask moderators for help
2701,please use the report feature if you believe a member is violating any of our rules we will then investigate please be patient our decision making process see below may delay a response
2702,no illegal content content that is deemed illegal in germany or france or according to european union rules regulations is not permitted at all on this server please report and block any such content coming from other servers and if needed block those servers
2703,rule 8 as of april 6 2024 0954 cest httpsanarresfamilyshevek112090444261653443 check pinned post on shevekanarresfamily
2704,signup are available only on invitation
2705,
2706,
2707,
2708,
2709,be kind to one another
2710,no racism sexism homophobia and transphobia will be allowed
2711,most of all have fun
2712,no porn
2713,be respectful to others
2714,no doxxing harassment or incitements of violence
2715,no spreading misinformation or conspiracy theories
2716,mark nsfwdisturbing content with a content warning
2717,no illegal content in accordance with new york california canadian law
2718,no spam or advertising
2719,no racism sexism homophobia transphobia xenophobia or casteism
2720,no incitement of violence or promotion of violent ideologies
2721,no harassment dogpiling or doxxing of other users
2722,do not share intentionally false or misleading information
2723,sei nett und geht gut miteinander um
2724,unterlasse bitte rassismus sexismus oder vergleichbare diskriminierungen gegen minderheiten
2725,kein sexueller inhalt gewaltdarstellungen oder andere illegale inhalte
2726,bitte melde verhalten das dich stört gerne hilft das moderationsteam dir wenn du fragen hast oder dich etwas stört
2727,соблюдайте чистоту и порядок с уважением относитесь к соседям
2728,не используйте ненормативную лексику в тексте и вложениях
2729,избегайте нелегального контента
2730,не распространяйте фейковые новости или дезинформацию
2731,sexually explicit or violent media must be marked as sensitive when posting
2732,no racism sexism homophobia transphobia xenophobia or casteism
2733,no incitement of violence or promotion of violent ideologies
2734,no harassment dogpiling or doxxing of other users
2735,do not share intentionally false or misleading information
2736,no trolling microaggressions or harassment see the code of conduct for the full list
2737,no bots advertising or spam
2738,no racism sexism discrimination against gender and sexual minorities ableism fatmisia xenophobia andor violent nationalism or the advocation of all of the above
2739,no content that includes sexual depictions of minors this includes loli content illegal in germany andor france such as holocaust denial or nazi symbolism conduct promoting the ideology of national socialism
2740,conduct intended to stalk or harass users impede users from using the service degrade the performance of the service or incite others to perform any of the aforementioned actions is disallowed
2741,no crypto nfts or aicreated content
2742,respect other users boundaries
2743,this is an 18 instance discussions including ones of sexuality drug use and historical and hypothetical violence are all possible within their appropriate contexts spoiler all images and discussions pertaining to the above as well as other potentially sensitive topics
2744,this is a radical left instance with emphasis on leftist intertendency discussion leftism here is defined as a strict anticapitalism b a revolutionary stance c solidarity with the entirety of the working class inclusive of all marginalized groups
2745,this is a furry instance you dont need to be a furry to be here but it helps this also means that this is a server with a high proportion of lgbt and neurodiverse people homophobia transphobia and ablism along with all other forms of bigotry are treated with zero tolerance
2746,no corporate advertisements no unspoilered twitter crossposts no metafacebook engagement
2747,do not post content which violates the friendly space policyuniversal code of conduct
2748,accounts are currently restricted to current wikimedia foundation staff
2749,soyez courtois et polis
2750,sont prohibés tous les propos à caractère calomnieux outrancier outrageux diffamatoire ordurier injurieux violent raciste ou pornographique incitant à la violence ou la discrimination
2751,sont prohibés tous les propos appelant à commettre un crime ou un délit faisant la propagande dactes malveillants
2752,sont prohibés tous les propos portant atteinte à lordre public à lintégrité de la personne au droit dauteur au droit à limage et au respect de la vie privée
2753,sont prohibés tous les propos portant atteinte au respect de la personne humaine et de sa dignité de légalité entre les femmes et les hommes de la protection des enfants et des adolescents
2754,sont prohibés le ciblage intentionnel dun mauvais genre lutilisation du prénom antérieur deadnaming ou la promotion de ce quon appelle la thérapie de conversion
2755,il est interdit de publier des liens hypertextes pointant sur des sites non conformes à la législation en vigueur
2756,il est interdit de publier des contributions non sollicitées à caractère publicitaire spam
2757,sexually explicit or violent media must be marked as sensitive when posting
2758,no racism sexism homophobia transphobia xenophobia or casteism
2759,no incitement of violence or promotion of violent ideologies
2760,no harassment dogpiling or doxxing of other users
2761,no content illegal in united states
2762,you must know joan server owner to request to join or be introduced from another member fill out reason for joining as how you know her if its through other social media please mention it and your user name
2763,no homophobia transphobia racism etc pronouns and identities should be respected
