,rules
0,
1,be kind to each other
2,no harassment on users on this or other servers will be tolerated
3,no sexism racism homophobia transphobia or any type of discrimination based on origin culture gender or any type of a defining aspect of a person on this or other servers will be tolerated
4,if you share explicit images they must be under content warning and the persons on it must be over 18 and consenting to the pictures being taken this server is not made to share your porn collection youll get banned if you do that
5,decisions made by admins are final
6,treat others as you wish to be treated
7,use your best judgement and common sense
8,do not intentionally break the law
9,pour maintenir une instance tolérante cette instance est intolérante à lintolérance httpsfrwikipediaorgwikiparadoxe_de_la_tolc3a9rance
10,de ce fait les idées racistes xénophobes islamophobes antisémites confusionistes rougebrunes homophobes transphobes ne sont pas les bienvenues
11,les discussions doivent se faire dans le respect de tous et toutes
12,le spam nest pas bienvenu non plus
13,les photos de vélos doivent être prises côté transmission
14,cette instance se donne le droit de ne pas fédérer avec des serveurs qui hébergent des comptes qui ne respectent pas les quatre premières règles
15,cette instance ne fédérera pas avec des serveurs tenus par des entités qui ont été accusées par lonu davoir aidé un génocide
16,no racism sexism homophobia transphobia or other bigotry
17,no trolling bullying or harassment of other users on this instance or elsewhere honest conflicts are inevitable but if someone asks you to leave them alone you are expected to do so
18,no endorsement of racism sexism homophobia transphobia antisemitism etc period
19,mark images in your posts that could be inappropriate for public viewing as sensitive this includes graphic violence sexual content and images that may be shocking
20,do not publicly reveal the personal information of others this includes sharing the contents of other users followersonly posts or direct messages without permission
21,all content uploaded to this service must be legal in the united states
22,no spamming or otherwise abusing this service this includes followbots and other bots that interact with users without their consent
23,include a descriptive content warning cw if youre posting something that readers will likely find upsetting or prefer to be optin explicit discussion of sex and violence must always be cwd for everything else use your judgment
24,
25,オープンな場が持続するよう努力しよう
26,堅すぎず柔らかすぎず自己主張しつつ譲り合いつつ控え目ながら大胆に
27,情報は鵜呑みにせず検討して議論して解決しよう
28,バックグラウンドの違いを理解して認識の幅を広げよう
29,dont be a dick
30,dont get me in trouble with the law or my network provider
31,dont embarrass me in front of the other mastodon admins
32,youre in my house dont give me a reason to kick you out
33,if you cause problems i will deal with you based on my perception of the severity
34,this could be anywhere from telling you to knock it off up to deleting your account and everything associated with it blocking your ips at the firewall and reporting you to your isp and law enforcement
35,please dont make me do the latter seriously
36,no rssfeed bots not related to a clacks user
37,no corporate accounts
38,no purely advertising accounts advertising your own things provided its not _all_ you do is fine
39,no parody accounts
40,all explicit sexual or violent content should be behind a cw
41,no racism or advocation of racism
42,no sexism or advocation of sexism
43,no discrimination against gender and sexual minorities or advocation thereof
44,no xenophobic andor violent nationalism
45,当サーバーはヒーローバンクの話題に限定しません日常の雑談や制作の進捗などにどうぞまたフォローせず連合タイムラインやローカルタイムラインを見るだけの登録もokですただしフォロワー限定の投稿は表示されないため基本的にはフォローしてホームタイムラインで見ることをおすすめします
46,公開投稿は世界中のさまざまなサーバーへ配信されます連合タイムライン経由でさまざまなサーバーへ配信されることを忘れないでください
47,ミュートやブロックは積極的に自分の快適なタイムラインは自分で作る 同じ作品が好きでも性格や嗜好があう人もいればあわない人もいますunderbankblueではミュートやブロックの積極的な使用をおすすめします
48,r15以上の性表現が含まれる画像にはnsfw職場閲覧注意の機能を使って画像を伏せて下さい r18以上のえっち文章は強制ではありませんがcwコンテンツワーニングの機能を使って文章を伏せることをおすすめしています 文章のほうが制限がゆるいのは日本の法律に合わせています
49,愚痴などネガティブ要素の多い投稿はcwを活用して下さい 愚痴などの見る人を選びやすい要素の投稿はcwコンテンツワーニング機能を使って文章を伏せて投稿して下さいネガティブな発言を見たくない人への配慮となりますまたunderbankblueは愚痴や悩みの投稿を制限することはありませんもやもやした気持ちを言葉にすることにより自身の思考を整理する効果があるためです積極的に活用して下さい
50,当サーバー独自の禁止事項管理人の趣味嗜好の都合で以下の要素を禁止します これらはあくまで当インスタンス内での扱いであり該当する二次創作の存在そのものを否定するものではありません 作中キャラクターの安易な変態化但しキャラクターの真面目さ不器用さ等公式の性格を重んじた結果の行動であればこの限りではありません 作中キャラクターの安易な守銭奴化ヤクザ化但しキャラクターの真面目さ不器用さ等公式の性格を重んじた結果の行動であればこの限りではありません どこからどこまでかの基準は管理者xanacに委ねられます
51,ヘイトスピーチ思想の押し付け等他者の表現の自由を阻害する行為を禁止します最終的な判断は管理者がジャッジを下します
52,conformément aux lois françaises et à la jurisprudence les contenus pédopornographiques y compris sous forme dessinée sont illégaux et seront supprimés et les comptes concernés bloqués si distants ou supprimés si local
53,la publicité sous forme répétée etou intrusive faisant mention dautres utilisateurices nest pas acceptée les comptes concernés seront rendus invisibles aux flux locaux et fédérés ou supprimés selon la gravité de la situation
54,sont interdits les propos images ou vidéos racistes sexistes homophobes ou transphobes
55,sont interdit toute conduite en public ou en privé ayant pour but de traquer harceler ou intimider dautres personnes
56,il est interdit de rassembler publier disséminer les informations personnelles dune autre personne sans son autorisation explicite
57,sont interdit toute conduite en public ou en privé ayant pour but de traquer harceler ou intimider dautres personnes
58,post good please
59,personal attacks derogatory remarks or discriminatory behaviour towards others based on any personal characteristics will not be tolerated
60,content that is considered obscene libelous hate speech or otherwise unlawful under canadian law will be removed immediately and the user who posted it banned without warning
61,users are responsible for vetting articleslinks they post or share users who deliberately and repeatedly post fake news without stating it is as such will be suspended or banned
62,bots are allowed only if they do not clutter the timeline perform mass follows or otherwise engage with other users without their permission please contact site administration before using bots to be sure they are appropriate or the bot may be banned
63,accounts that mislead or misrepresent the true identity of a user will be banned immediately no fake celebrities allowed unless the profile explicitly states it is fake
64,advertisements of any kind without the express written permission of site administration are prohibited please ask permission before posting anything of a commercial nature
65,use content warnings for sensitive topics such topics include lewdsexual content expressly political discussions healthsicknessdisorders picturesmedia that could be disturbing or harmful such as flashing images or loud sounds willful violators will have accounts silenced
66,絶対ネタバレは禁止ですリアル脱出ゲーム好きはわかりますね
67,cw や nsfw をつけたとしてもこのサーバでは18禁ネタは禁止です
68,bot や多量のフォローインポートなど当サーバへの負荷他サーバへの迷惑になる行為は禁止です
69,法律は守ってくださいね
70,迷惑ユーザと判断した場合はそのユーザを停止することがあります
71,on reste courtois sur ce site
72,on respecte la légalité
73,liberté égalité fraternité vous êtes libres de penser ce que vous voulez pas de lécrire ici merci de me signaler toute publication qui suggèrerait que certains humains sont supérieurs ou inférieurs à dautres pas chez moi
74,ici on respecte les règles de trapouille des éléphants et contrairement à ce que lon dit les mammouths sont des gars très polis bien rasés les ongles vernis
75,公序良俗と法に反せず各位仲良くワイワイやってね
76,no racism homophobia transphobia sexism or bigotry of any kind automatic ban or instance block when this is obviously observed
77,avoid pedantic nitpicking no one can be 100 perfect on 100 of the issues 100 of the time when tempted ask yourself if youre actually helping to educate someone or just stroking your own ego
78,engage in good faith and give people benefit of the doubt life is a learning experience and everyone makes mistakes remember the human
79,exploitation of rules 2 and 3 in order to stealthily engage in any form of harassment including breaking rule 1 is grounds for a ban or instance block
80,this server is not public open
81,no hate speech allowed no racism sexism transphobia ableism fatphobia and in general harrassment
82,use cws as much as possible general topics to cw are nudity hate speech when referring to it violence politics you can also use cws as spoilers warnings for movies games
83,always cw nsfw content and mark it as sensible
84,avoid public settling of differences if you have a problem with anyone try to resolve it privately or contact the moderation team unwanted subtoot is not allowed
85,do not harass anyone dont send targeted hatred to someone repeated attacks to a specific person participate in mass bullying
86,本日は晴天なり
87,sexually explicit or violent media must be marked as sensitive when posting
88,no racism sexism homophobia transphobia xenophobia or casteism
89,no incitement of violence or promotion of violent ideologies
90,no harassment dogpiling or doxxing of other users
91,no content illegal in germany
92,toots should be written in english french or dutch until we have more moderators we cannot add other languages
93,dont be an idiot
94,佛系不论政
95,荒らさない 無用な連投やふぁぼブースト連打は本サーバーやネットワークに負荷をかけるだけです ネタとしてやるならokですが常識の範囲でね
96,法律の範囲で自由 何を発言しても何を投稿しても問題ないけど国内法に触れない範囲で もちろん人が嫌がることはしちゃダメです
97,みんな仲良く 人数が少ない招待制サーバーなのでギスギスしてるよりはほんわか仲良くありたいものです
98,cwnsfwを活用しよう 長ーい長文を投稿する時やセンシティブな話題を投稿するときは積極的にcwを活用しようね 成人向け画像を投稿する時にはnsfwを活用しようね
99,dont be a dick
100,dont spam
101,dont sockpuppet
102,mod and admin decisions are final
103,be excellent to each other
104,i already spend too much time on this machine dont make me waste more time i am the superuser and have little patience
105,マインクラフトを使用する場合はそのeulaと関連する規約を守ってください
106,マインクラフトのmodプラグインその他これに類するものを使用する場合はそれらの利用規約を守ってください
107,日本法またはeu圏の法律で違法とされるものはトゥートブーストお気に入りにしないでください注 このインスタンスはeu圏内に設置されています
108,人々の感情を動かし良い気持ちにさせることを心がけましょう
109,仲良く楽しくマストドンを
110,
111,
112,
113,
114,dont harrass others
115,use tools user block instance block user report for dealing with problems adminsmods will take care of reports
116,punch nazis they are not welcome here
117,keine belästigung stalking oder doxxing
118,kein rassismus sexismus beschimpfungen oder deren befürwortung
119,keine diskriminierung von geschlechtern und minderheiten
120,keine gewalttätige nationalistische propaganda nazisymbolismus oder förderung der ideologie des nationalsozialismus
121,keine kontaktaufnahme zu menschen die deutlich gemacht haben dass sie keinen kontakt wollen dogpiling
122,kein posten und verbreiten von sexuellem inhalt gewaltdarstellungen oder falschinformationen
123,werbung muss als solche gekennzeichnet sein keine übermäßige oder automatisierte werbung
124,keine inhalte die gegen die gesetze der bundesrepublik deutschland verstoßen
125,
126,
127,
128,
129,
130,
131,
132,
133,
134,
135,
136,
137,公序良俗に反する行為はしないでください
138,日本国内の法律条例に違反する投稿はしないでください
139,誹謗中傷など他の人への精神的経済的な負担を与える投稿はしないでください
140,他の人の著作権を尊重し侵害しないよう心がけてください
141,アフィリエイトなど商業利用はできません
142,その他にもいくつかルールがあるので利用規約を確認してください
143,no racism
144,no sexism
145,no discrimination
146,no stalking
147,no content illegal in germany such as holocaust denial or nazi symbolism
148,much fluff
149,much gay
150,respectezvous les uns les autres
151,ne pas envoyer de spamflood
152,pas de racisme de xénophobie de sexisme de discrimination de propagande ️
153,veuillez ne pas publier de contenu illégal ou de liens vers en france
154,pour le contenu nsfw utilisez lavertissement de contenu ou le filtre nsfw sinon veuillez afficher votre toot comme non listé
155,utilisez lavertissement de contenu pour les spoilers
156,les bots et les comptes commerciaux sont autorisés uniquement si ils ne sont pas spamflood
157,un compte local peut être suspendu ou banni sil ne respecte pas les règles
158,nous ne bloquonssuspendons les comptes et les instances étrangères que pour des raisons juridiques
159,les comptes inactifs depuis 1 mois aucune connexion au compte seront supprimés
160,amusezvous bien
161,nfswlewdadult content must be hidden behind a cw
162,do not post content owned by someone else without permission
163,no posts promoting excessive or extremist levels of violence
164,no distribution of malware or other potentially unwanted software through the service
165,no hurtful or targeted language to attack a certain group or user
166,no excessive trolling
167,no misappropriating memes as use as hate symbols this includes posting memes that are largely considered to be hate symbols
168,no stalking or harassment
169,no intentional attempts to mislead or impersonate a specific user or group
170,利用規約 httpsplusminusiomstdnplusminusiotermsofservice
171,die verwaltung und moderation wird so neutral wie möglich gehandhabt
172,die ergriffenen maßnahmen beschränken sich auf das nötigste um den betrieb des netzes aufrechtzuerhalten und die fähigkeit der nutzer der instanzen mit anderen personen in verbindung zu treten nicht zu beeinträchtigen
173,kommunikation vor aktionen es wird zuerst versucht über probleme und lösungen zu sprechen
174,wir empfehlen keine blocks
175,keine schuld durch assoziationverband
176,bleibt freundlich und höflich behandle andere mit respekt
177,halte dich an die in österreich geltenden gesetze
178,keine belästigung stalking undoder doxxing von anderen
179,rassismus sexismus oder beschimpfungen haben hier nichts verloren
180,nicht markierter sexueller inhalt undoder gewaltdarstellungen in jeglicher form sind nicht erlaubt
181,bots die ohne ihre expliziten anfragen mit nutzer interagieren werden gelöscht
182,übermässige werbung spam spamflut von wiederholenden tröts sind nicht erwünscht
183,日本国内で違法とされている行為をしないこと 実写エロ無修正や犯罪教唆著作権法違反不正指令電磁的記録の頒布など
184,過剰にサーバーに負荷をかける行為をしないこと 大量のリクエスト呼び出し限度を超えて反復する巨大ファイルのアップロードなど他人の利用に影響が出かねない行為をしないこと
185,コミュニティに荒らさないこと 荒れた反応をしたくなる相手は自発的にミュートブロックすること また過度な煽り機能の濫用cwの無設定など人に優しくないtlを作らないこと
186,性的r18コンテンツ政的コンテンツについてはcwすること せいてきこんてんつはcwと覚えてください職場で見ても大丈夫なtlにしましょう
187,使い方を読んでから始めること httpshackmdioepuhmvyrgibcyndhfk3pqsj93ltqta
188,1 preamble
189,friendica is a decentralised communications platform that integrates social communication the website at httpsfriendicahubuppro known as hubuppro collective is an independent notforprofit service that uses friendicas source code we the owner and operator of the website provide this service to you under these terms
190,by accessing the website at httpsfriendicahubuppro you are agreeing to be bound by these terms of service all applicable laws and regulations and agree that you are responsible for compliance with any applicable local laws if you do not agree with any of these terms you are prohibited from using or accessing this website
191,this website is available only to individuals who are at least 15 years old
192,2 username password security
193,if you create an account on this website you agree to be entirely responsible for maintaining the confidentiality of your password you are entirely responsible for all activities that occur underor with your username and password you agree to notify immediately the website administrator at infohubuppro of any unauthorized uses of your account or any other breaches of security
194,we will not be liable for any loss that you may incur as a result of someone else using your username or password either with or without your knowledge
195,3 content
196,all content posted via this website is the sole responsibility of the person who originated such content we may not monitor or control the content posted via this website and we cannot take responsibility for such content
197,if you are exposed to spamming online harassment grossly offensive content or illegal content you may notify the website administrator
198,your posts
199,you are responsible for any content you provide including compliance with applicable laws rules and regulations
200,content that you provide may be removed if it is perceived as not complying with applicable laws rules and regulations
201,other peoples posts
202,any use or reliance on content posted via this website is at your own risk we do not endorse support represent or guarantee the completeness truthfulness accuracy or reliability of any content posted via this website or endorse any opinions expressed via this website and any other linked website
203,you understand that by using this website you may be exposed to content that might be offensive harmful inaccurate or otherwise inappropriate or in some cases postings that have been mislabelled or are otherwise deceptive
204,4 provision of service
205,we provide this service in good faith and to the best of our ability we have a long performance record however we cannot guarantee an uninterrupted service and or a service entirely free of data loss
206,you can follow the website administrator who in the unlikely event of a service disruption will post status notifications
207,5 termination of service
208,we may terminate your access to all or any part of this website at any time we usually inform you if we disable your login or delete your account
209,we routinely delete inactive user accounts in the following cases
210,user has never logged in and account was created more than 5 days ago
211,user has never had a single public post and has not logged in for more than 30 days
212,user has not logged in for more than 180 days
213,you can request an exemption from these inactivity restrictions by contacting the website administrator
214,we routinely remove dedicated spam accounts that were created on this website this includes profile spamming and link spamming if you engage in such activities we may or may not inform you of deleting your account
215,all account deletions are permanent and will result in a loss of user identity and content
216,6 modifications
217,we may revise these terms of service at any time you can hear about such changes by following the website administrator
218,by using this website you are agreeing to be bound by the then current version of these terms of service
219,7 governing law
220,these terms and conditions are governed by and construed in accordance with irish law and you irrevocably submit to the exclusive jurisdiction of the courts of the republic of ireland
221,cats rule and dogs drool addendum my cat drools sometimes so enforcement is subjective
222,if you dont get a registration email directly reach out via httpsdrasticalnetcontact and let me know
223,no incitement of violence or promotion of violent ideologies
224,please be kind and courteous apply the silver rule dont treat others like you wouldnt like to treated
225,harassment of any kind is unacceptable and a direct violation of the communickcom terms of service
226,absolutely no content that would be considered illegal in germany
227,sexually explicit or violent media must be marked as sensitive when posting
228,no bot account unless explicit permission from the server admins is granted
229,nic nezákonnýho dle zákonů české republiky
230,respect finnish law
231,no spamming or mass advertising
232,no nazism national socialism discrimination or graphic violence
233,this isnt a place for pornography
234,no harrasment of other users or promotion of violence
235,nudité et pornographie sont strictement interdites nous désactiverons ou bloquerons les comptes sans mise en garde
236,tous propos haineux discriminatoire peu importe la forme ne sont pas tolérés sur cette instance et entraînera une suppression ou un blocage immédiat du compte responsable de ces infractions
237,toutes formes de harcèlement envers dautres utilisateurs de cette instance ou dautres instances ou envers une personne physique ou moral ne sont pas non plus tolérées ici
238,le contenu illégal qui ne respecte pas les droits dauteurs ou plus largement la loi française sera supprimé et le compte responsable de ces infractions sera soumis à examen
239,si latelier du numérique venait à être saisie par la justice française pour non respect de la loi nous nous réserverons le droit de dénoncer la personne responsable des faits incriminés envers latelier du numérique
240,les spams ne sont pas acceptés
241,la publicité est acceptée dans la mesure ou elle nest pas rébarbative et ou elle ne forme pas le contenu exclusif du compte
242,aucune action haineuse racisme sexisme homophobie etc
243,pas de doxxing
244,si vous ne le feriez pas en tant quinvité chez quelquun ne le faites pas ici
245,注册后7天内无任何操作如发嘟换头像的账号将被删除
246,请不要发布对性取向性癖爱好信仰宗教政治立场民族地域等的侮辱性言论 来自cmx
247,请不要对任何用户发送具有骚扰猥亵恐吓威胁诱骗霸凌性质的内容不受欢迎的性暗示内容或其他令他人感到不安或不适打扰他人正常生活的内容 来自cmx
248,请不要发布种族主义性别主义性少数群体恐惧跨性别恐惧仇外和或暴力民族主义言论以及其他形式的歧视煽动仇恨人身威胁的 cmx和gov5站
249,请不要发布与本站用户完全不相干的推广内容cmx
250,严禁对其他用户实施任何人肉行为包括公开发布他人在其他平台上的涉及他人隐私个人信息或资料的内容违反本条的用户将被直接执行封禁操作相应嘟文会被删除cmx
251,严禁使用包括但不限于任何形式的自动化程序等手段大量获取本站的数据例如您不得使用本站的api或任何类似于爬虫的软件或设备将数据用于正常交流以外的用途违反本条的用户将被直接执行冻结操作 cmx
252,在宇宙联邦别站或者其他任何地方的不当行为和或言论也会导致你在皮卡站的号被封因此如果你在别的网站或者线下有骚扰歧视仇恨言论等等等等你在本站的号也会没有
253,请不要把本站当成图床
