,rules
1464,dont be a dick remember the human on the other side of your screen
1465,no hate speech
1466,all nsfw content images text etc must be placed in a content warning
1467,transphobia homophobia racism and other kinds of bigorty is not allowed in any way
1468,dont be a dick to others
1469,dont make us make more rules
1470,dont be a dick thats not a suggestion we use active moderation against racism sexism homophobia and transphobia trans men are men trans women are women if you disagree dont be here
1471,the easier it is for me to maintain this server the more likely it stays up long term see rule 1
1472,if we dont know you personally you cant have an account were confident we can handle 20 people up from two two weeks ago but we are resourcelimited really stop asking
1473,as we operate under united states jurisdiction we are required to follow dmca protocols here is a copy of our dmca statement and compliance rules httpssolarbirdnetmastodonhtml please do not make us have to use them
1474,while we are a private instance we can be required to turn over user data where required by law or by order or other legal requirement of a court administrative or law enforcement agency or governmental entity
1475,data posted here but replicated to other instances can be similarly subpoenaed in those instances under the terms of their local laws this information includes but is not limited to posted content and identifying information such as ip addresses
1476,no new links to twitter as of 2 june 2023 i will not be in any way aid elon musks altright propaganda machine or a man who personally sticks antitrans propaganda video in the faces of tens of millions of people if that is not acceptable you are welcome to migrate to another instance
1477,sexually explicit or violent media must be marked as sensitive when posting
1478,no racism sexism homophobia transphobia xenophobia or casteism
1479,no incitement of violence or promotion of violent ideologies
1480,no harassment dogpiling or doxxing of other users
1481,no content illegal in the uk
1482,do not share intentionally false or misleading information
1483,isms in my opinion are not good a person should not believe in an ism he should believe in himself i quote john lennon i dont believe in beatles i just believe in me good point there after all he was the walrus ferris bueller
1484,be excellent to each other
1485,no hateful or aggressive speech harassment or spamming
1486,no content illegal in the united states of america
1487,no bigotry any form of bigotry is grounds for account termination since i vet everyone the chance of this happening is exceedingly low but i want it to be explicit also terfs and nazis fuck off
1488,dont be a dick theres no value to it it just makes you a dick
1489,post in good faith if you assume someone is posting in bad faith well your reply will probably also be in bad faith so just dont
1490,dont dogpile theres no value in it it doesnt make the world a better place no one wants to see it and its a waste of your own time
1491,vet your content looking at you metal folk no one wants to see known white supremacists boosted so if you get called out for it thats on you
1492,unfollowmuteblock and move on while i encourage using cws for trauma triggers there is no expectation of cws for topical content if someone is posting content you dont want to see remove them and move on
1493,dont post anything illegal in the eu because thats where this site is hosted and doing so risks me simply taking the server entirely offline to avoid any legal issues
1494,현재는 서버 관리자 지인 위주로 가입을 받고 있습니다
1495,트위터에서 오시는 분은 가입 사유에 트위터 핸들을 써주시면 승인이 빨라집니다
1496,확인 메일이 오지 않을경우 스팸메일함을 확인해주세요
1497,dont be a jerk
1498,친절하고 정중하게 행동해 주세요
1499,sexually explicit or violent media must be marked as sensitive when posting
1500,no racism sexism homophobia transphobia xenophobia or casteism
1501,no incitement of violence or promotion of violent ideologies
1502,no harassment dogpiling or doxxing of other users
1503,do not share intentionally false or misleading information
1504,no nsfw loli pedophile zoophile content
1505,no illegal content
1506,no spam
1507,日本国内法は守ってください法律違反や迷惑行為の自慢や助長する書き込み犯罪に加担していそうだったり法律に抵触するようなトゥートは禁止です最悪警察や裁判所の要請に応じてログを開示することになります
1508,無修正エロ画像は絶対禁止ですその他のエロについては二次三次を問わず18禁になりそうな文章にはcwcontent warningを画像にはnsfwタグを付けてください例え付けていても日本国内法に抵触するような画像は禁止です
1509,スパム行為など迷惑行為にしか見えないような宣伝とかもやめてください
1510,自分がされたら嫌なことは他人にしないみんな仲良く どうしても合わない人とかいると思いますその場合はブロックやミュートを上手に活用してね
1511,本サーバーは1人の管理者によって管理されていますそのため24時間365日の稼働や障害の即時復旧などを保証するものではありません
1512,サーバーの設定構成やサーバスペックについては負荷度合いを見て調整を実施します
1513,サーバーのメンテナンスに伴う停止などは管理者アカウントにて告知します
1514,本サーバーの名前はテレビ特撮作品仮面ライダーゼロワンからきていますが他の特撮作品の話題も大歓迎ですまた特撮に関係ないことでも別に投稿していただいても問題ありません
1515,
1516,
1517,
1518,
1519,
1520,
1521,sexually explicit or violent media must be marked as sensitive when posting
1522,no racism sexism homophobia transphobia xenophobia or casteism
1523,no incitement of violence or promotion of violent ideologies
1524,no harassment dogpiling or doxxing of other users
1525,no spam advertising or bot accounts
1526,do not create posts or send messages which violate purdues policies eg on academic integrity
1527,homophobia transphobia racism and all other forms of bigotry and discrimination are forbidden entirely
1528,do not harass users of this or any other mastodon instance
1529,the administration reserves the right to totally revoke all service to any user at any time for any reason
1530,登録に際して管理人であるchiefをフォローしてくださいよろしくお願いします
1531,elsies only
1532,gesunden menschenverstand einschalten
1533,keinen quatsch machen
1534,nicht frech werden
1535,sexually explicit or violent media must be marked as sensitive when posting
1536,no racism sexism homophobia transphobia xenophobia or other woke shit
1537,no harassment dogpiling or doxxing of other users
1538,do not share intentionally false or misleading information
1539,voir les conditions générales dutilisation des services libretic dans notre règlement intérieur httpslibreticfraproposreglementinterieur
1540,dans un souci de sobriété numérique afin de limiter la quantité de stockage nécessaire pour le fonctionnement de notre instance mastodon nous vous demandons dactiver dans vos préférences la fonctionnalité de suppression automatique des messages anciens
1541,nos adhérents ont fait le choix dutiliser des logiciels libres et sans traçage si vous repostez du contenu vu sur dautres réseaux évitez de mettre des liens vers ces réseaux et recopiez le contenu ou le cas échéant le lien vers larticle dorigine site web article de presse par exemple
1542,bez kłamstwa chamstwa agresji fałszu przemocy oszustw i obrażania kogokolwiek
1543,promotion of your games projects and storefronts are allowed and encouraged but spam is not do not directly message users to advertise
1544,sexually explicit or gory media must be marked as sensitive andor hidden under a content warning cw when posting because they cannot be marked all avatars headers and bio content must be appropriate for all audiences
1545,no sexual depictions of minors
1546,no racism sexism queerphobia transphobia xenophobia or bigotry of any kind no nazi or altright symbolism or ideology
1547,no harassment dogpiling bullying or doxxing
1548,no content illegal in canada or the usa
1549,no nfts no crypto no blockchain
1550,no content generated using tools like midjourney and stable diffusion which are trained on the works of others without their consent attribution or compensation procedural generated content or models trained on properly licensed source data are allowed
1551,please be normal
1552,be nice to mod silver he is delicate
1553,se amable
1554,only sfw
1555,play nice
1556,dont spam or advertise in a chat we have channels for advertising art and other personal stuff please use them they will be listed in the chat list dming random people for advertising is not ok and will result in us removing you use the chats designed for advertising
1557,dont be mean common sense is your friend just be nice in general if someone asks you not to do something because it bothers them just dont do it if we think you are a troll spammer or inviting bots we are going to remove you
1558,nondirected jokes in poor taste are acceptable unless someone takes offence read your audience
1559,glorification or promotion of illegal activities is not permitted talking about cp will get you instabanned
1560,unless the chat is for a specific language please expect to use the english language we have german and russian chats if you think we should have another language chat just ask
1561,invalidating someones personal identity is not okay likewise dont make a big deal out of someones identity including your own
1562,this is not the setting to preach your views on a particular subject when others have moved on
1563,dont post politics or religion it never ends well and youre only setting yourself up to get into an argument everyone is different everyone is welcome keep this in mind
1564,statements which are meant to cause harm or are generally offensive are not allowed think before you speak your thoughts are your own however some should stay private
1565,casual discussion of selfharm physically or mentally is not acceptable for example talking about how you frequently drink until you pass out or having constant mental breakdowns in chat if you need help reach out and one of our staff can give you a list of hotlines to call
1566,when posting images to a chat or channel keep them on topic if youre talking about cars in the musician chat you should probably join the auto furs chat
1567,if your account looks like a bot no username no bio no profile picture we might remove it take the 5 minutes to edit your profile and appear like a real person
1568,obey the perroom rules listed in the description of chatschannels
1569,ai images should somehow be made known they are ai generated through conversation or use of a tag title or spoiler
1570,sexuellt explicita eller våldsamma medier inklusive konst måste markeras som känsliga vid inlägg
1571,ingen rasism sexism homofobi transfobi eller funkofobi
1572,ingen uppvigling till våld eller främjande av våldsbejakande ideologier
1573,inga trakasserier dogpiling eller doxxing av andra användare
1574,inget innehåll som är olagligt i sverige får spridas
1575,ingen får utge sig själv att vara andra människor eller organisationer
1576,sprid inte desinformation
1577,ingen rasism sexism homofobi transfobi eller främlingsfientlighet
1578,ingen uppvigling till våld eller främjande av våldsbejakande ideologier
1579,inga trakasserier eller påhopp
1580,inget innehåll som bryter mot svensk lag
1581,ingen delning av avsiktligt falsk eller vilseledande information
1582,this is a server for official accounts of independent publishers and bookshops based in the uk
1583,accounts on this server are on an invitationonly basis and invitations are given at the discretion of the administrator
1584,hate speech will not be tolerated this includes racism homophobia transphobia misogyny and other forms of abuse
1585,any explicit or nsfw content posted must use a content warning
1586,no content that is illegal in the united kingdom
1587,no harmful misinformation or harrassment of others
1588,we expect accounts on this server to be friendly and respectful if any accounts are found by the administrator not to be upholding these rules they will be given the opportunity to move to another server
1589,violence you may not threaten violence against an individual or a group of people we also prohibit the glorification of violence we allow some forms of violent speech where its clear that there is no abusive or violent intent eg ill kill you for sending me that plot spoiler
1590,terrorismviolent extremism you may not threaten or promote terrorism or violent extremism
1591,child sexual exploitation we have zero tolerance for child sexual exploitation accounts engaging in such activity will be permanently removed
1592,abuseharassment you may not engage in the targeted harassment of someone or incite other people to do so this includes wishing or hoping that someone experiences physical harm
1593,hateful conduct you may not promote violence against threaten or harass other people on the basis of race ethnicity national origin caste sexual orientation gender gender identity religious affiliation age disability or serious disease
1594,suicide or selfharm you may not promote or encourage suicide or selfharm
1595,sensitive media including graphic violence and adult content you may not post media that is excessively gory or share violent or adult content without content warning cw media depicting sexual violence andor assault is not permitted
1596,illegal or certain regulated goods or services you may not use our service for any unlawful purpose or in furtherance of illegal activities this includes selling buying or facilitating transactions in illegal goods or services as well as certain types of regulated goods or services
1597,private information you may not publish or post other peoples private information such as home phone number and address without their express authorization and permission we also prohibit threatening to expose private information or incentivizing others to do so
1598,nonconsensual nudity you may not post or share intimate photos or videos of someone that were produced or distributed without their consent
1599,platform manipulation and spam you may not use this service in a manner intended to artificially amplify or suppress information or engage in behavior that manipulates or disrupts peoples experience
1600,civic integrity you may not use this service for the purpose of manipulating or interfering in elections or other civic processes this includes posting or sharing content that may suppress participation or mislead people about when where or how to participate in a civic process
1601,misleading and deceptive identities you may not impersonate individuals groups or organizations to mislead confuse or deceive others nor use a fake identity in a manner that disrupts the experience of other users
1602,synthetic and manipulated media you may not deceptively share synthetic or manipulated media that are likely to cause harm such content require clear content warning cw that it is not real
1603,copyright and trademark you may not violate others intellectual property rights including copyright and trademark
1604,parody parody is allowed parody accounts must be labeled in biohandle if they impersonate another person or institution
1605,conspiracy theories we will limit all efforts connected to dissemination of various harmful conspiracy theories on our network satirical conspiracy theories such as birds arent real are allowed
1606,sexually explicit or violent media should carry appropriate content warning
1607,no racism sexism homophobia transphobia xenophobia or casteism no nazis
1608,no incitement of violence or promotion of violent ideologies
1609,no harassment dogpiling or doxxing of other users
1610,do not share intentionally false or misleading information
1611,no spam or selfpromoting posts
1612,no bots that are not labeled as such in their profile
1613,keep conversations civil and respectful even in disagreement
1614,no racism sexism homophobia transphobia xenophobia antisemitism or casteism
1615,no sexually explicit media allowed
1616,no incitement of violence or promotion of violent ideologies
1617,no illegal content
1618,fuck putin
1619,no moment moments
1620,nothing illegal
1621,no spam
1622,no ads
1623,nothing sexually explicit
1624,no bullying
1625,no harassment
1626,spoilersanything of questionable violence should be marked with a content warning
1627,be nice
1628,keine diskriminierung no discrimination
1629,kein antisemitismus no antisemitism
1630,keine pornografie no pornography
1631,keine gewaltdarstellung oder androhung no violent images or intimidation
1632,keine hetze no hate speech
1633,keine verschwörungsideologien no conspiracy beliefs
1634,kein sexismus no sexism
1635,kein rassismus no racism
1636,keine homophobie no homophobia
1637,keine transphobie no transphobia
1638,kein spam noch rein kommerziellen nachrichten no spam nor purely commercial posts
1639,wir achten auf disinformation und sperren gegebenenfalls ebensolche we monitor disinformation and block them if necessary
1640,safe space for lsbtqia safe space lgtbqia
1641,geht respektvoll miteinander um be respectful
1642,sexually explicit or violent media must be marked as sensitive when posting
1643,no racism sexism homophobia transphobia xenophobia or casteism
1644,no incitement of violence or promotion of violent ideologies
1645,no harassment dogpiling or doxxing of other users
1646,do not share intentionally false or misleading information
1647,no content illegal to the united states
1648,be kind dont be a jerk
1649,be insurance nice
1650,you may not threaten or glorify violence against an individual or a group of people you may not threaten or promote terrorism or violent extremism
1651,you may not share or promote content that is nsfw
1652,you may not engage in targeted harassment or incite others to do so
1653,you may not promote or threaten violence against or harass anyone on the basis of race ethnicity national origin caste sexual orientation gender gender identity religious affiliation age disability or serious disease
1654,you may not post threaten to post or encourage others to post anyones private information without their express permission
1655,you may not promote misinformation or disinformation
1656,you may not impersonate individuals groups or organizations in a manner to mislead confuse or deceive others parody accounts are acceptable if the profile indicates that it is a parody
1657,you may not spam brandcorporate accounts and selfpromotion are acceptable so long as the content makes a positive contribution to insurance or risk
1658,violating one or more of these rules may result in an immediate permanent ban without notice or warning lack of a specific rule against a certain behavior does not indicate acceptance of that behavior each of us has a limited amount of time in this world dont be a jerk
1659,みんな仲良くしてください
1660,法または道徳に反する投稿はやめてください
1661,投稿画像や動画には必要と認める場合は閲覧注意フラグを付与してください
1662,サーバーに過度な負荷をかけないでください
1663,bots using this server will only post a news item once
1664,only california local bots will use this server thirdparty bots are not permitted
1665,california local bots will only post news or telemetry from verified sources
1666,no harassment discrimination doxing or abuse of any kind
1667,no spam
1668,no sharing asking for or linking to illegal content
1669,as we have a few community contributors in the server please respect their time and understand there will be things they can not and will not discuss
1670,take all rules as guidelines and act accordingly in doubt feel free to address buggieserenityossocial linusgserenityossocial or networkexceptionserenityossocial directly the administrator team always has the last word about enforcement of rules and does not have to explain actions taken
1671,do the best you can in communication try your best to keep a positive attitude and try to not drag others down ifwhen youre having a bad day
1672,no content condoning or advocating for the oppression of members of marginalised groups or general discrimination of groups based on characteristics like gender race disabilities nationality education religion etc
1673,no harassment stalking mobbing deadnaming misgendering contacting users who have made it clear they do not wish to be contacted
1674,no content that is illegal in germany
1675,unlike on the discord server the discussion of politics is explicitly allowed here but please keep things civil
1676,provide credit for creative works that are not your own
1677,while we do appreciate all kinds of content you post on here consider other instances for nsfw posts if you still wish like publishing on here use descriptive content warnings
1678,hate speech or speech that incites violence or hate against any individual or group regardless of intent will not be tolerated offending toots will be blocked repeat offenders may be blocked
1679,fair use will be enforced that is to say we encourage creativity and will not honor frivolous copyright claims claims that comply with us copyright laws will be honored expeditiously
1680,there are currently no filtered mastodon instances on madworld if youd like to request an instance be filtered toot paulgeller
1681,de server staat in nederland en dus is de nederlandse wetgeving van toepassing
1682,deze dienstverlening dient de doelen van de vereniging open domein zoals geformuleerd in de statuten
1683,als gebruiker heeft u een dedsnladres daarmee krijgt u een account en communiceert u met de server en de beheerder
1684,als gebruiker schendt u de privacy van anderen niet
1685,als gebruiker begint u geen ad hominems en reageert u niet op ad hominems persoonlijke aanvallen
1686,als gebruiker bedrijft u geen commercie zoals iets verkopen of daartoe oproepen
1687,deze dienst wordt aangeboden door portagio sponsor van de vereniging open domein open domein heeft projecten zoals deds en petitiesnl
1688,sexually explicit or violent media must be marked as sensitive when posting
1689,no racism sexism homophobia transphobia xenophobia or casteism
1690,no incitement of violence or promotion of violent ideologies
1691,no harassment dogpiling or doxxing of other users
1692,no content illegal in the us
1693,do not share intentionally false or misleading information
1694,bots must be marked as bot in their profile
1695,no spamming or aggressive promotion if you want to promote something do it responsibly with supporting facts and never only links
1696,no racism sexism homophobia transphobia xenophobia or casteism
1697,no incitement of violence or promotion of violent ideologies
1698,no harassment dogpiling or doxxing of other users
1699,no misinformation or disinformation
1700,no personal attacks
1701,no illegal activity
1702,no racism sexism homophobia transphobia xenophobia or casteism
1703,no incitement of violence or promotion of violent ideologies
1704,do not share intentionally false or misleading information
1705,no content illegal in malaysia
1706,no spam harassment dogpiling or doxxing of other users this includes mass and spam reporting
1707,no racism sexism homophobia transphobia xenophobia or bigotry in general
1708,sexually explicit or violent media must be marked as sensitive when posting
1709,no incitement of violence or promotion of violent ideologies
1710,no harassment of any kind
1711,no antivaccination no false information no antiscience and no conspiratorial ideologies
1712,no fascists nazis altright white supremacists or religious zealots
1713,no scams misinformation conspiracies et al
1714,please create a profile when your account is approved regularly sign in and become an active member of the community accounts that register and do nothing are generally removed after 1 month
1715,차별하지 마세요 서로 다름을 존중하세요
1716,남을 괴롭히거나 귀찮게 굴지 마세요
1717,남에게 불쾌감을 주는 내용엔 cw 기능을 설정하세요
1718,상대를 특정할 수 있는 정보를 허락 없이 게시하지 마세요
1719,영리 목적의 홍보 및 스팸을 게시하지 마세요
1720,신고 기능을 쓰세요 규칙을 어긴 사람과 직접 싸우지 마세요
1721,기타 대한민국 법령을 위반하는 내용을 게시하지 마세요
1722,seid freundlich
1723,postet nichts verbotenes
1724,no fakenews
1725,werbepostings müssen gekennzeichnet werden
1726,meinungsfreiheit ist keine einbahnstraße
1727,日本の法律と社会規範に従った行動を心がけてください
1728,不快や脅威に対してはブロックミュートフィルターで距離をとってください
1729,投稿する際は適切な公開範囲cw閲覧注意を使用してください
1730,管理人がきつくなったらやめます
1731,dont be a dick treat other people here as neighbors
1732,no excessive advertising
1733,no discrimination based on gender sexual minority sexual orientation disability physical appearance body size race ethnicity religion or lack thereof caste or national origin
1734,no stalking or harassing others
1735,no hacking or impeding others from using the site
1736,no gore or graphic violence
1737,content that is borderline nsfw or could be construed as nsfw at a glance should be put behind a cw content warning
