,rules
756,no means no if someone asks you to stop responding to them your business with them is done further interactions are harassment and are not allowed
757,dont host or share anything illegal
758,dont make me add more rules
759,hakuna matata
760,no sexually explicit images or video
761,no incitement of violence or promotion of violent ideologies
762,no false or misleading information
763,no racism sexism homophobia transphobia xenophobia or casteism
764,no harassment dogpiling or doxxing of other users
765,no illegal content
766,no commercial promotion of nfts or crypto
767,please use content warnings cw on any content that is controversial ranty crossposts from the other site or noncontent updates
768,follow wheatons first rule dont be a dick
769,
770,
771,
772,
773,
774,teilnehmen dürfen alle ehrenamtlichen trainer und mitglieder auch fördermitglieder des fbl
775,staffmitglieder können sich direkt mit ihrem zentralen login benutzername passwort wie cloudlogin anmelden
776,alle anderen mitglieder geben bei der registrierung als beitrittsgrund bitte ihren namen und mitgliedsnummer zur verifikation an
777,keine hasskommentare hatespeech etc dies ist kein rechtsfreier raum
778,es wird um einen freundlichen ton und die übliche netiquette gebeten
779,du solltest mindestens 16 jahre alt sein oder die zustimmung deiner eltern für die nutzung besitzen
780,no abuse no trolling no spam
781,here we value kindness and consideration creativity and intelligence good humor and good will
782,keep it clean have fun and all will be well
783,
784,не допускаются оскорбления и холивары на тему политики религии гендерной принадлежности сексуальной ориентации национальности и прочего корректная дискуссия построенная на взаимном уважении не равно оскорбления и холивары
785,запрещено разглашение чьихлибо персональных данных без предварительного согласия
786,запрещено размещение порнографического контента обнаженных детей расчленёнки и прочих шокирующих материалов в том числе созданных с помощью графических инструментов или сгенерированных ии
787,допускается размещение материалов эротического содержания обязательно под спойлером sensitivensfw media
788,язык преимущественно русский допускается свободное использование украинского английского языков и эсперанто
789,крайне желательно оставлять описание к загружаемым медиа это в том числе может помочь людям с нарушением зрения
790,
791,
792,
793,
794,
795,
796,ласкаво просимо до українських локальних серверів mastodon
797,ми адміністратори українських локальних серверів mastodon як частини httpsdcommnetua є прихильниками вільних дискусій свободи слова прав людини та взаємоповаги
798,адміни залишають за собою право блокувати користувачів з країниагресора
799,спілкування українською та англійською мовами вітається й заохочується
800,не допускається заперечення російської агресії проти україни воєнних злочинів росії тимчасової окупації криму донецької луганської та інших областей україни
801,не допускаються погрози та мова ненависті на адресу інших користувачів
802,поширення російської дезінформації та кремлівських наративів є підставою для блокування
803,якщо ви помітили порушення правил цього сервера будь ласка повідомте про це адміністратора або ж пишіть на mastodonequalitieorg
804,не шалить
805,政治的思想的な主義主張の話は避けにこにこふわふわしたことをつぶやきましょう
806,特定の個人や集団への明らかに冗談と一般的に判断されないような暴言は禁止ですまた差別的発言暴言の域を超えた誹謗中傷は無条件で禁止です
807,偽情報を拡散しないようニュースや噂話等に言及する際は情報源を確認するなどの裏取りを心がけてください
808,性的な表現ネタバレ等センシティブな情報を含むトゥートをする際はcwやnsfwを設定することを心がけてください
809,上記のほか日本米国ユーザー居住国の各国国内法およびさくらインターネット基本約款に定める禁止事項に違反するトゥートは禁止します
810,上記各項目に違反した場合トゥートの削除をお願いすることがありますただし2後段5に違反した場合や違反頻度が高い場合削除要請に合理的な理由なく従わない場合は警告なくトゥートの削除やアカウントの凍結を行うことがあります
811,上記すべての項目はトゥートだけでなくブーストの内容も対象となります
812,法律は守ってください
813,cwやnsfwはちゃんと使ってください
814,他人に迷惑をかけたり不快にするような行為は禁止です
815,みんな仲良く
816,sexually explicit or violent media must be marked as sensitive when posting
817,no racism sexism homophobia transphobia xenophobia or casteism
818,no incitement of violence or promotion of violent ideologies
819,no harassment dogpiling or doxxing of other users
820,no content illegal in germany
821,do not share intentionally false or misleading information
822,willkommen auf der poller instanz seid respektvoll und lieb zueinander
823,1 freundlich höflich 2 rücksichtsvoll und aufmerksam
824,this is a community communities need kindness empathy and moderation
825,harassing stalking demeaning attacking and slurring will not be tolerated
826,humans run this site and we reserve the right to define those words as necessary to keep everyone happy and safe
827,please share and comment on things that have been edited or gone through peer review
828,please do not share anything that hasnt been verified reviewed or edited somewhere else this is not a place to break news
829,регистрация на сервере доступна для всех вы можете пользоваться всеми функциями сервера без ограничения пока это не нарушает другие правила сервера права других пользователей и других сетей и законы рф
830,сервер создан и администрируется мной на чистом энтузиазме я не беру денег за использование его ресурсов
831,я осуществляю поддержку пользователей на добровольных началах поэтому не устанавливаю срок ответа на ваше обращение также я не могу гарантировать что смогу решить вашу проблему но постараюсь сделать это
832,аккаунты в информации о которых указаны реквизиты адреса телефоны email коммерческих организаций а посты или отсутствуют или содержат в основном рекламную информацию будут безжалостно блокироваться
833,на инстансе запрещено размещение материалов пропагандирующих превосходство одних людей над другими по свойствам не зависящим от них раса национальность место рождения пол сексуальная ориентация внешность и т д
834,на инстансе запрещено размещение материалов связанных с распространением наркотиков оружия взрывчатки порнографии и других материалов запрещенных законом
835,на инстансе запрещено хамское оскорбительное отношение к другим пользователям этого сервера и других узлов fediverse
836,на инстансе запрещены назойливая реклама и спам
837,на инстансе запрещена публикация чьихлибо личных данных без прямого и явного согласия владельца этих данных
838,на инстансе запрещена пропаганда идеологическая и религиозная
839,на инстансе запрещена публикация изображений и текстов содержащих обнаженную натуру и сцены насилия без скрытия из под тэгом nsfw
840,
841,
842,
843,
844,
845,
846,
847,правила не окончательные и могут меняться дополняться поэтому рекомендовано заглядывать в этот раздел время от времени
848,соблюдайте правила общения принятые в приличном обществе уважайте себя и остальных участников
849,запрещены публикации содержащие спам порно грубую нецензурную лексику
850,публикации спорного содержания помечайте как nsfw деликатного характера или cw скрытый текст
851,запрещены публикации нарушающие законодательство российской федерации и страны вашего проживания пребывания
852,жалобы принимаются только по встроенному в интерфейс механизму обращений не нужно писать админу в личку или на почту
853,do not try to be not tokhmi
854,dont be a douchebag
855,refer to rule 1
856,no hate speech speech that nefariously expresses a form of prejudice or threatens a people of a protected characteristic such as age disability ethnicity gender pregnancy religion sex or sexuality unpopular opinions voiced respectfully is fine
857,no calls to violence any individual promoting violence towards any person or group
858,no intentionally circumventing blocks for example by creating new accounts even on a separate instance with the intent of circumventing a banblock
859,no harassment if a user explicitly asks you to disengage and you do not explicit calls to dogpile will not be acceptable
860,all bots must respect the nobot tag and must post unlisted
861,posts intended for commercial advertisement purposes must be posted with the ad tag or unlisted
862,nudity involving the genitals sexual acts or pornography must be posted either unlisted with a content warning or both
863,站长事实上拥有本站所有权力但是承诺不滥用
864,原则上禁止一切可能对其他人造成伤害的行为在某种程度上可以容忍程度轻微不好判断的行为但是建议不要给其他人任何人造成麻烦
865,不希望存在滥用服务器资源的行为本站硬盘占用空间上限为120g根据站长个人使用经验一百人以内应该都是够用的以后会根据站长的经济条件在未来会适当提高
866,服务器目前在美国洛杉矶所以请遵守当地法律
867,禁止在墙内公开讨论宣传本站
868,如有违反规则站长会先私信警告拒绝改正则直接删号
869,good dogs always allowed and encouraged
870,keep it safe keep it legal malicious content illegal dangerous phishing doxing etc and promotion of these activities is never allowed
871,nudity must be marked with cw when uploading something a reasonable person would consider nsfw use spoiler options failure to do so will result in your post being deleted
872,encourage equality diversity and inclusion our differences are our strength harassment and discrimination of any kind is not tolerated here we are lgbtq friendly
873,be excellent to each other experience levels range from brand new photographers to seasoned shooters be kind and helpful keep all feedback constructive and framed positively seek to educate without being condescending or elitist
874,dont be a dick head
875,chuds get the boot this includes uwu smol soft fascists
876,no scrapers search indexers other surveillance tech bullshit
877,capitalism apologia no thank you comrade
878,регистрация без vpn и без локальной сети выходим в интернет напрямую без ухищрений тогда и регистрация пройдет без проблем забыли пароль есть возможность его сбросить и через email зайти снова сменив пароль подробности здесь httpskub2091runode760
879,администратор и модераторы регулярно выбираются совместно на внутренних выборах
880,соблюдаем заявленную тематику советской литературы нарушения наказываются баном
881,основные правила могут уточнятся и дополнятся на основе решений открытого актива участников
882,be excellent to each other
883,party on dudes
884,la libertad de uno termina cuando empieza la libertad del otro mientras no molesten a otros publiquen a gusto y piacere
885,no racism sexism homophobia transphobia xenophobia or casteism
886,je te jure le serveur il a des règles ne me déferre pas
887,diese regeln gelten für unsere fediverse angebote wie friendica pixelfed und peertube sowie für alle anderen apps die wir anbieten
888,eine registrierung mit einmalemailadressen ist untersagt useraccounts mit solchen adressen werden kommentarlos gelöscht
889,rassismus sexismus homophobie transphobie fremdenfeindlichkeit dulden wir nicht
890,teilen sie keine inhalte die in deutschland illegal sind
891,teilen sie keine inhalte die falsche oder irreführenden informationen enthalten
892,teilen sie keine gewalttätige nationalistische propaganda nazisymbolismus oder förderung der ideologie des nationalsozialismus
893,belästigen sie keine anderen teilnehmer
894,keine absichtlichen provokationen aka trolling
895,befördern sie keine gewalt
896,kennzeichne inhalte bitte mit nsfw wenn erotische oder gewalttätige inhalte dargestellt werden
897,der versandt und das posten von pornografischen material führt unmittelbar zu einer löschung des account
898,keine handlungen die dieser instanz schaden sei es der technik dem ruf oder der sicherheit
899,gehen sie sparsam mit den systemressourcen um
900,bots die ohne ihre expliziten anfragen mit nutzer interagieren
901,wollen sie kommerziell werben sprechen sie das zuvor mit dem admin der instanz ab
902,diese regeln können jederzeit erweitert werden um eine freundliche sichere und inklusive umgebung mit einer gesunden kommunikation untereinander zu gewährleisten wir geben aber bescheid bevor änderungen wirksam werden mindestens 14 tage falls wer als reaktion auf die änderungen mit dem konto umziehen möchte
903,stand 05032024
904,enginn hatursáróður það er bannað að vera með eða endurbirta hatursáróður dæmi rasismi transfóbía
905,innihaldsviðvörun cw á nekt setjið innihaldsviðvörun á nekt auðvitað geta verið undantekningar þannig að þið notið dómgreindina
906,crypto bitcoin nft og þess háttar farið varlega þegar þið deilið efni sem fjallar um crypto af því það er mikið um vafasamar fullyrðingar og tilboð
907,ofbeldi og fólk í neyð notið innihaldsviðvaranir á efni sem inniheldur ofbeldi ekki deila myndum af fólki í neyð ef líkur eru á því að það vilji ekki að slíkt efni fari í dreifingu
908,engar falsfréttir ekki deila tenglum á falsfréttamiðla þó allir geri stundum mistök í að meta slíkt
909,breytingar á færslum það er mögulegt að breyta færslum á mastodon vinsamlegast farið varlega í að breyta færslum sem þegar eru komnar í dreifingu og búnar að fá endurbirtingar sumsé ekki breyta færslum á villandi hátt þannig að meining þeirra breytist
910,aucun propos haineux à légard de minorités
911,bienveillance envers toustes les membres du réseau
912,faites usage des cw pour tout message pouvant heurter la sensibilité
913,nul besoin délitisme acceptez la diversité des écrits
914,
915,
916,
917,
918,
919,
920,
921,
922,ласкаво просимо до українських локальних серверів mastodon
923,ми адміністратори українських локальних серверів mastodon як частини httpsdcommnetua є прихильниками вільних дискусій свободи слова прав людини та взаємоповаги
924,адміни залишають за собою право блокувати користувачів з країниагресора
925,спілкування українською та англійською мовами вітається й заохочується
926,не допускається заперечення російської агресії проти україни воєнних злочинів росії тимчасової окупації криму донецької луганської та інших областей україни
927,не допускаються погрози та мова ненависті на адресу інших користувачів
928,поширення російської дезінформації та кремлівських наративів є підставою для блокування
929,якщо ви помітили порушення правил цього сервера будь ласка повідомте про це адміністратора або ж пишіть на mastodonequalitieorg
930,wir als betreibende und mitnutzer erwarten eine angenehme atmosphäre und einen wertschätzenden umgangston
931,wir als betreibende und mitnutzer dulden keine rassistischen beleidigenden sexistischen homo oder transphoben beiträge
932,es gelten die gesetzlichen bestimmungen beleidigungen jedweder art können zur anzeige gebracht und straftrechtlich verfolgt werden
933,do not use slurs or racist sexist homophobic transphobic ableist or otherwise discriminatory or hateful jokes or language or promote white supremacy antisemitism transphobia or other hateful ideologies
934,do not harass anyone participate in group harassment of anyone or otherwise engage in personal attacks posting or threatening to post other peoples personally identifying information doxing constitutes harassment
935,do not be intentionally antagonistic a post or reply designed to provoke a confrontation is not acceptable
936,do not post spam a toot that is nothing other than a link constitutes spam as does any overly commercial selfpromotion it is fine however to toot about your own projects and share what you are excited to be working on just keep the toot itself interesting
937,do not shitpost while humorous posts are allowed and actually encouraged
938,do not post about inflammatory controversial subjects without a content warning
939,do not engage in name calling ad hominem attacks or any other uncivil behaviour criticize ideas never people
940,do not tone police toots may violate the standards of civility we set on dindon but you should not criticize users for their tone report them or feel free to block them in neither case should you criticize their tone
941,do not debate moderation actions in public toots if you disagree with how a moderator enforced this coc you may directmessage the moderation team or email admindindonone
942,do not toot in languages other than english swedish russian which makes moderation prohibitively difficult
943,sexually explicit or violent material must be marked as sensitive when posting please make a goodfaith effort to mark other content that people might find troubling as well
944,content that is harmful to vulnerable populations will not be tolerated absolutely no racism sexism homophobia transphobia xenophobia or casteism
945,no incitement of violence or promotion of violent ideologies
946,no harassment trolling dogpiling or doxxing of other users here or elsewhere
947,no content illegal in the united states
948,rule enforcement and interpretation is entirely at site administrations discretion were not here to debate you
949,behavior that forces us to be more specific or expansive with our rules can result in a permanent ban dont be a dick
950,no hate speech or harassment of any users anywhere you will be banned
951,no illegal activities
952,youre a nazi andor hate gay people go away
953,be nice kind and understanding of each other
954,no incitement of violence or promotion of violent ideologies
955,do not share intentionally false or misleading information including antivaxxcovid theories
956,no racism sexism homophobia transphobia xenophobia or casteism
957,no content illegal in sweden
958,cw content warning tag must be used for any gore smut nudity nsfwnsfl stuff anything people may want to prepare themselves for or to not see over works wifi
959,cw content warning tag encouraged but not mandatory use for politics dwpgovernment horror spoilers and discussion of plot for media and books or extensive roleplaying discussion that may not be interesting to everyone but please use them for anything you want theyre helpful
960,unwanted content repetitive commercial spam updates on ongoing projects are fine but identical repetition of adverts is not this instance is for talking to people about yourtheir cool stuff not commercial business advertisements
961,unwanted content bots please ask first if you want to run a bot please make sure it posts unlisted or followers only and be careful with it
962,shitty banned content racism sexism homophobia transphobia being shitty to gender sexual minorities including kinkshaming ableism sexualised depictions of children or lolicon not the fashion violent nationalism facism national socialism holocaust denial casteism or xenophobia
963,shitty banned behaviour dont stalk harass wide interpretation dox or post any private information about people names or other aliasesaccounts addresses locations pictures etc without permission
964,shitty banned behaviour respect requests to drop subjectsstop interacting with people including unsolicited advice dont try and get others to gang up on anyone dont be an arse and hassle people about their bodies minds or lives tldr dont be an edgelord or ill socialised prat
965,peoples time and energy are not infinite no obligation to follow or interact with others if someones posting or topics are exhausting then please disengage from themfilter out keywords if someone unfollowsblocksfilters you try not to feel bad about it assume they are busyexhausted
966,unwanted members no cops no fash no tories no concerned right wing individuals just asking questions
967,no discrimination including but not limited to racism sexism homophobia or transphobia
968,no nsfw not safe for work content
969,no harassment of other users on this or other servers
970,no content illegal in the following countries united kingdom germany france
971,no incitement of violence or promotion of violent ideologies
972,no disinformation regarding public health issues or politicalmilitary campaigns
973,no spam this includes commercial advertising promotional campaigns and seo
974,патриархальные устои соблюдать в обязательном порядке
975,сиськи постить с пометкой nsfw иначе нас перестанут пускать в приличные места
976,постить больше котиков и сисек
977,если сраться то что бы было весело окружающим
978,no discrimination including but not limited to racism sexism homophobia or transphobia
979,no explicit nsfw content without content warnings andor sensitive media markers explicit content must not be used in user avatars or header images
980,no harassment of other users on this or other servers
981,no content illegal in the following countries canada
982,no incitement of violence or promotion of violent ideologies
983,no disinformation regarding public health issues or politicalmilitary campaigns
984,follow the law this server is hosted in germany and thus will comply with german laws and eu regulations
985,no hatespeech of any kind
